post_id,influencer_id,platform,date,URL,caption,reach,likes,comments
POST_00001,INF_0001,YouTube,2025-05-01,https://www.youtube.com/inf_0001/post_00001,Sapiente possimus placeat commodi itaque sint sequi expedita dolore nulla voluptatum soluta voluptatem accusantium. #HKVitals #XUWXF,137967,3118,624
POST_00002,INF_0001,YouTube,2024-10-08,https://www.youtube.com/inf_0001/post_00002,Officia reprehenderit doloribus exercitationem autem eum animi voluptas officia numquam rem eligendi eveniet molestias laudantium. #Gritzo #TYGEU,106342,4030,335
POST_00003,INF_0002,YouTube,2025-06-27,https://www.youtube.com/inf_0002/post_00003,Officia assumenda totam optio culpa impedit quo earum aliquam necessitatibus neque. #Gritzo #WVGUC,154870,5786,526
POST_00004,INF_0002,YouTube,2024-11-01,https://www.youtube.com/inf_0002/post_00004,Cupiditate nisi cupiditate expedita excepturi pariatur fugiat quidem eum alias assumenda necessitatibus officiis dolorum tenetur. #HKVitals #HUFAF,65147,2147,519
POST_00005,INF_0002,YouTube,2025-04-03,https://www.youtube.com/inf_0002/post_00005,Consequatur dolore temporibus esse provident facilis nesciunt itaque quae cumque dolorem quia. #HKVitals #QKZNY,30024,1223,101
POST_00006,INF_0002,YouTube,2024-08-30,https://www.youtube.com/inf_0002/post_00006,Quidem magnam alias deserunt officiis voluptate mollitia iste neque maxime nam ipsa impedit doloribus. #MuscleBlaze #CLSIP,95361,2187,345
POST_00007,INF_0002,YouTube,2025-06-01,https://www.youtube.com/inf_0002/post_00007,Laboriosam eaque occaecati nisi laboriosam cumque repellat. #MuscleBlaze #SAYNS,133389,4194,490
POST_00008,INF_0002,Instagram,2024-11-13,https://www.instagram.com/inf_0002/post_00008,Ut nesciunt accusamus perspiciatis blanditiis inventore laboriosam voluptas illo assumenda non odio est quaerat atque expedita. #Gritzo #XQRDX,94652,4976,546
POST_00009,INF_0002,Twitter,2025-01-15,https://www.twitter.com/inf_0002/post_00009,Optio incidunt dolorum sed consequuntur incidunt earum minus reiciendis repellat. #HKVitals #OERJT,39704,754,94
POST_00010,INF_0003,YouTube,2025-06-20,https://www.youtube.com/inf_0003/post_00010,Omnis vel mollitia dolorum numquam tempore odio voluptas illo assumenda delectus. #HKVitals #FUPIL,495388,12487,2540
POST_00011,INF_0003,Twitter,2025-02-22,https://www.twitter.com/inf_0003/post_00011,Repudiandae quidem unde impedit a mollitia earum assumenda. #MuscleBlaze #RHRQC,679832,9027,964
POST_00012,INF_0004,Instagram,2025-02-25,https://www.instagram.com/inf_0004/post_00012,Alias occaecati sequi illo sed iusto optio vitae id beatae occaecati asperiores. #MuscleBlaze #BZPTL,352245,20743,3885
POST_00013,INF_0004,YouTube,2025-07-16,https://www.youtube.com/inf_0004/post_00013,Ipsum harum ad perspiciatis laudantium doloribus dolore vero occaecati vero possimus sunt sed commodi. #HKVitals #KDRXW,351997,18573,1677
POST_00014,INF_0004,Twitter,2025-03-09,https://www.twitter.com/inf_0004/post_00014,Vitae rerum accusantium similique laudantium nam nam maiores maiores eius a earum nesciunt. #Gritzo #MOXDD,196421,6140,948
POST_00015,INF_0004,YouTube,2025-06-02,https://www.youtube.com/inf_0004/post_00015,Natus ratione sunt dolorem optio consequatur nulla molestias reprehenderit corrupti eveniet. #HKVitals #PSNVO,356338,17526,2416
POST_00016,INF_0004,YouTube,2025-01-04,https://www.youtube.com/inf_0004/post_00016,Quisquam quia nam commodi iste fugit est libero. #MuscleBlaze #VHUMG,187264,9356,870
POST_00017,INF_0005,YouTube,2024-09-30,https://www.youtube.com/inf_0005/post_00017,Harum nihil asperiores iure minus deleniti fugiat aliquam doloremque. #Gritzo #CDJDF,152402,3343,455
POST_00018,INF_0005,Instagram,2024-11-09,https://www.instagram.com/inf_0005/post_00018,Explicabo at aliquid commodi quo quaerat quod. #MuscleBlaze #VKUYA,299822,14166,1959
POST_00019,INF_0005,YouTube,2025-02-18,https://www.youtube.com/inf_0005/post_00019,Totam deserunt neque alias sapiente vel excepturi dolores atque alias facere aperiam repudiandae quasi. #HKVitals #TWYKT,193947,5886,533
POST_00020,INF_0005,Instagram,2024-08-28,https://www.instagram.com/inf_0005/post_00020,Perferendis non dolorum eum facilis quidem animi soluta saepe sunt est. #HKVitals #LAIRK,73335,3302,245
POST_00021,INF_0005,Twitter,2025-06-14,https://www.twitter.com/inf_0005/post_00021,Dolorem tempore iusto incidunt labore voluptatum magnam praesentium adipisci quaerat delectus cum earum repudiandae eaque. #Gritzo #AKOAQ,64047,1161,70
POST_00022,INF_0005,YouTube,2025-05-05,https://www.youtube.com/inf_0005/post_00022,Rem voluptate repellendus non assumenda doloremque deserunt porro. #HKVitals #FITJT,284398,6019,399
POST_00023,INF_0005,Instagram,2025-07-10,https://www.instagram.com/inf_0005/post_00023,Porro delectus corporis possimus excepturi facere occaecati id quaerat laborum sed ipsum rem enim quis molestiae. #Gritzo #OZJQU,227376,11515,2744
POST_00024,INF_0006,Instagram,2025-03-05,https://www.instagram.com/inf_0006/post_00024,Dolore fugit rem veniam reiciendis quam architecto facere tempore qui quis magnam fugit. #Gritzo #DDROF,544178,31879,2591
POST_00025,INF_0006,Twitter,2025-05-11,https://www.twitter.com/inf_0006/post_00025,Ipsa natus asperiores harum corrupti ex soluta dolore unde rerum eligendi adipisci delectus rerum. #Gritzo #SUEIP,707136,12382,2832
POST_00026,INF_0006,YouTube,2024-11-03,https://www.youtube.com/inf_0006/post_00026,Porro rem ipsa debitis consectetur rem itaque eum sequi quos. #HKVitals #YFPVG,542565,11056,1991
POST_00027,INF_0006,Instagram,2025-02-14,https://www.instagram.com/inf_0006/post_00027,Nemo delectus repellendus asperiores minima officiis ipsam ex aspernatur ducimus. #Gritzo #UJLJN,289727,16162,3388
POST_00028,INF_0006,Instagram,2024-10-01,https://www.instagram.com/inf_0006/post_00028,Asperiores veritatis asperiores dolor labore eaque impedit reiciendis veniam. #HKVitals #YQVSL,568563,37890,3770
POST_00029,INF_0007,YouTube,2024-07-27,https://www.youtube.com/inf_0007/post_00029,Aut doloremque natus maiores accusantium consectetur ea. #HKVitals #LTGWV,2142,81,7
POST_00030,INF_0007,YouTube,2024-11-18,https://www.youtube.com/inf_0007/post_00030,Iusto architecto consequuntur illum molestias impedit neque possimus veniam excepturi quam eaque. #Gritzo #PJAWE,3894,136,15
POST_00031,INF_0007,Twitter,2025-06-23,https://www.twitter.com/inf_0007/post_00031,Necessitatibus ad temporibus optio maxime quam incidunt qui. #Gritzo #WONEG,6609,128,11
POST_00032,INF_0007,YouTube,2024-11-22,https://www.youtube.com/inf_0007/post_00032,Soluta a numquam odit similique aut omnis eos voluptate asperiores in. #Gritzo #SLAHK,4330,136,15
POST_00033,INF_0007,Twitter,2025-06-16,https://www.twitter.com/inf_0007/post_00033,Sapiente explicabo consequatur deserunt omnis alias quibusdam iusto. #Gritzo #IZOJL,5215,64,12
POST_00034,INF_0007,YouTube,2025-02-02,https://www.youtube.com/inf_0007/post_00034,Occaecati quis a voluptatum iure minus nam ex in culpa. #MuscleBlaze #TYRET,4794,131,25
POST_00035,INF_0007,Twitter,2025-01-09,https://www.twitter.com/inf_0007/post_00035,Magni nihil aut esse a nesciunt quasi nam. #HKVitals #ZVHJH,10823,128,7
POST_00036,INF_0007,Instagram,2025-02-13,https://www.instagram.com/inf_0007/post_00036,Quidem magnam vero dignissimos laboriosam nam eos cumque eum quasi omnis excepturi inventore. #Gritzo #HYQTC,1102,38,5
POST_00037,INF_0007,YouTube,2024-12-05,https://www.youtube.com/inf_0007/post_00037,Sequi odit maiores a at enim molestiae natus officia aperiam sapiente culpa autem. #MuscleBlaze #ZGWCB,7801,214,38
POST_00038,INF_0007,Instagram,2025-05-12,https://www.instagram.com/inf_0007/post_00038,Nisi accusamus reprehenderit eveniet hic eveniet non ab vero sed laudantium ipsa. #MuscleBlaze #VYCGO,6745,317,52
POST_00039,INF_0008,YouTube,2024-11-28,https://www.youtube.com/inf_0008/post_00039,Eaque qui voluptates accusamus id corrupti doloribus consequuntur ullam blanditiis. #HKVitals #XHPLO,31508,1291,89
POST_00040,INF_0008,Instagram,2025-03-21,https://www.instagram.com/inf_0008/post_00040,Recusandae iste cupiditate placeat deleniti dicta quia et laborum delectus voluptates voluptatibus. #Gritzo #FREEB,17217,705,113
POST_00041,INF_0008,YouTube,2025-03-16,https://www.youtube.com/inf_0008/post_00041,Non libero atque porro explicabo nobis voluptas quo soluta itaque rerum reiciendis debitis animi officia. #MuscleBlaze #GSSLR,245958,8137,1365
POST_00042,INF_0008,Twitter,2025-03-24,https://www.twitter.com/inf_0008/post_00042,Rerum debitis excepturi minus recusandae earum veritatis cumque quod fuga quos harum ullam. #MuscleBlaze #LOQXV,34284,413,43
POST_00043,INF_0008,Twitter,2024-10-01,https://www.twitter.com/inf_0008/post_00043,Sequi ipsa dicta corporis in delectus molestias dolore tempora iure reprehenderit illum dolorem odio. #Gritzo #XLMHK,84151,1548,202
POST_00044,INF_0008,Twitter,2024-08-10,https://www.twitter.com/inf_0008/post_00044,Omnis magnam praesentium deleniti error eius aperiam repudiandae. #MuscleBlaze #XTPAF,183980,4315,691
POST_00045,INF_0008,Instagram,2025-01-01,https://www.instagram.com/inf_0008/post_00045,Ipsam voluptatibus commodi saepe ipsum repellendus fugit tempore fuga reiciendis ea distinctio alias. #Gritzo #VOTEN,126357,3936,980
POST_00046,INF_0008,YouTube,2024-07-24,https://www.youtube.com/inf_0008/post_00046,Consequatur repellendus nulla cum fugiat sunt incidunt quaerat sequi eligendi minus. #Gritzo #VZMKI,42525,749,94
POST_00047,INF_0008,YouTube,2025-06-22,https://www.youtube.com/inf_0008/post_00047,Expedita labore nisi repellendus esse quasi at adipisci earum incidunt. #HKVitals #RKTAC,79223,1221,242
POST_00048,INF_0008,Twitter,2025-05-30,https://www.twitter.com/inf_0008/post_00048,Hic ad distinctio asperiores eveniet eaque tenetur. #MuscleBlaze #ROKEJ,204376,3846,754
POST_00049,INF_0009,YouTube,2024-08-13,https://www.youtube.com/inf_0009/post_00049,Corporis quo veritatis natus aperiam ipsa sequi quisquam dicta sunt. #Gritzo #DHWMA,418935,13775,2554
POST_00050,INF_0009,YouTube,2024-10-10,https://www.youtube.com/inf_0009/post_00050,Occaecati mollitia necessitatibus unde molestias quod a deserunt inventore quis eaque ab. #Gritzo #AKFVC,609578,19454,1534
POST_00051,INF_0009,Twitter,2024-08-29,https://www.twitter.com/inf_0009/post_00051,Dolorum repellendus totam ullam quae consequuntur alias quidem ab. #HKVitals #NHVZG,371577,5330,1236
POST_00052,INF_0009,Twitter,2025-01-03,https://www.twitter.com/inf_0009/post_00052,Necessitatibus harum sed laudantium voluptatibus blanditiis maiores atque incidunt quam dicta quasi eum a ipsam temporibus. #Gritzo #WWHUK,601873,10031,2099
POST_00053,INF_0009,YouTube,2025-04-29,https://www.youtube.com/inf_0009/post_00053,Qui accusamus fuga libero sit provident quisquam labore aut perferendis. #Gritzo #HPZMD,363949,8002,1225
POST_00054,INF_0010,YouTube,2025-04-07,https://www.youtube.com/inf_0010/post_00054,Magni eius necessitatibus alias nisi vero accusantium aliquid. #HKVitals #YWZGJ,879617,21685,2348
POST_00055,INF_0010,YouTube,2024-11-22,https://www.youtube.com/inf_0010/post_00055,Aperiam sint voluptates numquam consequuntur quidem exercitationem quibusdam. #Gritzo #XJZUQ,208561,8534,631
POST_00056,INF_0010,Twitter,2025-04-13,https://www.twitter.com/inf_0010/post_00056,Natus asperiores in quia perspiciatis inventore perspiciatis debitis. #HKVitals #WWLNL,752281,11662,2029
POST_00057,INF_0010,Instagram,2025-04-01,https://www.instagram.com/inf_0010/post_00057,Magnam quisquam saepe nam reiciendis eaque temporibus et asperiores soluta. #MuscleBlaze #MZISQ,875567,48612,10591
POST_00058,INF_0010,YouTube,2025-04-24,https://www.youtube.com/inf_0010/post_00058,Magnam dolor explicabo illo beatae quas accusantium fugit modi officiis non iste sit tempora. #HKVitals #QXMOQ,287368,9260,950
POST_00059,INF_0010,Instagram,2024-10-11,https://www.instagram.com/inf_0010/post_00059,Veritatis quas totam odio ad nulla quam veniam quaerat voluptatibus omnis numquam sit libero fugit dolorem. #Gritzo #CZTSC,222155,8398,482
POST_00060,INF_0010,YouTube,2024-09-27,https://www.youtube.com/inf_0010/post_00060,Sed dignissimos odio magni neque tenetur non cupiditate neque doloremque porro. #MuscleBlaze #HJDNO,819086,15445,1018
POST_00061,INF_0010,YouTube,2025-04-28,https://www.youtube.com/inf_0010/post_00061,Ducimus nobis enim accusamus vel soluta quam quam nihil. #Gritzo #RMPGQ,501677,14316,3245
POST_00062,INF_0010,YouTube,2024-12-04,https://www.youtube.com/inf_0010/post_00062,Rem tenetur vel molestias a accusantium voluptas itaque ea nesciunt rem. #HKVitals #RELIP,672673,17020,1632
POST_00063,INF_0010,YouTube,2024-12-11,https://www.youtube.com/inf_0010/post_00063,Ad porro veritatis labore libero consequuntur nobis delectus dolores similique. #MuscleBlaze #ZWCJJ,345618,11772,662
POST_00064,INF_0011,YouTube,2025-04-14,https://www.youtube.com/inf_0011/post_00064,Amet autem optio ea dignissimos aliquam veritatis molestiae voluptate dicta. #MuscleBlaze #ORTBP,477286,27356,2802
POST_00065,INF_0011,Instagram,2024-08-06,https://www.instagram.com/inf_0011/post_00065,Molestias libero accusantium laborum enim earum et rerum saepe asperiores eum molestias laborum quod. #Gritzo #UFEGT,706650,50415,3824
POST_00066,INF_0011,Instagram,2025-03-11,https://www.instagram.com/inf_0011/post_00066,Sequi illum impedit consectetur sed minus cupiditate eligendi animi et provident repudiandae culpa voluptatum impedit. #Gritzo #QILPT,132835,5753,1112
POST_00067,INF_0011,Instagram,2024-08-12,https://www.instagram.com/inf_0011/post_00067,Et iusto at quisquam quis sunt at vero similique ex dolor dicta nesciunt. #MuscleBlaze #DOZNX,760023,30900,6495
POST_00068,INF_0011,YouTube,2024-09-09,https://www.youtube.com/inf_0011/post_00068,Quibusdam quibusdam eum magni culpa rerum iure molestias deserunt. #HKVitals #TICZD,875261,45073,8498
POST_00069,INF_0011,YouTube,2025-05-29,https://www.youtube.com/inf_0011/post_00069,Voluptatum non officia distinctio recusandae ea nam. #Gritzo #JUANL,626473,28499,4550
POST_00070,INF_0011,Twitter,2024-10-30,https://www.twitter.com/inf_0011/post_00070,Tenetur illum iste dolores eius repellendus quasi ab dolorem voluptatem accusantium sapiente. #HKVitals #CGAWO,831848,19753,1249
POST_00071,INF_0011,YouTube,2025-06-13,https://www.youtube.com/inf_0011/post_00071,Sequi perspiciatis sit ab aspernatur quas vel id quisquam voluptatem consequuntur sequi perspiciatis in laboriosam. #Gritzo #HKDYH,473811,10402,2331
POST_00072,INF_0012,YouTube,2024-11-12,https://www.youtube.com/inf_0012/post_00072,Repellendus debitis assumenda sapiente ex ut nihil reprehenderit. #HKVitals #JYSOP,368772,13055,2272
POST_00073,INF_0012,YouTube,2025-05-22,https://www.youtube.com/inf_0012/post_00073,Consequuntur sapiente natus quam fuga quam iure harum deleniti asperiores minus. #Gritzo #KYAJL,472885,17981,1248
POST_00074,INF_0012,Twitter,2025-04-18,https://www.twitter.com/inf_0012/post_00074,Corrupti fuga occaecati molestias ipsa tempora ab ipsam. #HKVitals #OZJKE,87781,2087,279
POST_00075,INF_0012,Twitter,2025-01-19,https://www.twitter.com/inf_0012/post_00075,Voluptates laboriosam quae quia consequuntur laboriosam dolore voluptatem. #MuscleBlaze #QPAUG,89531,1792,114
POST_00076,INF_0013,Instagram,2024-11-24,https://www.instagram.com/inf_0013/post_00076,Modi ea voluptate similique porro animi quam ducimus doloremque nihil magni. #Gritzo #FWIDX,39793,2509,193
POST_00077,INF_0013,Instagram,2024-12-24,https://www.instagram.com/inf_0013/post_00077,Voluptate necessitatibus ipsum facere mollitia repellendus occaecati iure tempore modi perspiciatis architecto modi qui odit nam. #Gritzo #GERAA,490477,16313,1783
POST_00078,INF_0013,Instagram,2024-07-31,https://www.instagram.com/inf_0013/post_00078,Ipsa eligendi et ad voluptate corrupti eum quia corporis asperiores fuga suscipit. #HKVitals #BTNTM,483625,22876,1625
POST_00079,INF_0013,Twitter,2025-03-21,https://www.twitter.com/inf_0013/post_00079,Quibusdam odit vero aut quisquam quidem harum ab dignissimos commodi. #MuscleBlaze #YBUWN,300423,8276,520
POST_00080,INF_0013,YouTube,2025-04-24,https://www.youtube.com/inf_0013/post_00080,Quo quidem sint ut optio blanditiis cupiditate omnis necessitatibus tempora deserunt possimus. #HKVitals #LCSLX,222595,4031,298
POST_00081,INF_0013,Twitter,2025-01-06,https://www.twitter.com/inf_0013/post_00081,Commodi quasi sequi iste numquam illo pariatur aliquam tempore corporis dolor error quod. #Gritzo #PSJPH,327624,5066,1029
POST_00082,INF_0013,Instagram,2024-09-09,https://www.instagram.com/inf_0013/post_00082,Omnis saepe unde dolorum consequuntur mollitia eaque illo nihil similique laudantium molestiae. #Gritzo #QTSFL,168994,6252,836
POST_00083,INF_0013,YouTube,2025-01-11,https://www.youtube.com/inf_0013/post_00083,Sequi minus minima saepe perferendis quibusdam culpa tempora eaque. #Gritzo #CLRJD,566627,7956,1684
POST_00084,INF_0013,Instagram,2024-09-28,https://www.instagram.com/inf_0013/post_00084,Ipsum velit eos laborum architecto at eligendi tempore placeat sequi excepturi quas vitae. #HKVitals #CTVOP,359707,13902,1019
POST_00085,INF_0013,YouTube,2025-03-06,https://www.youtube.com/inf_0013/post_00085,Doloribus officiis debitis fugiat a magnam nostrum magnam. #Gritzo #YKXBH,217063,3435,495
POST_00086,INF_0014,Twitter,2024-10-17,https://www.twitter.com/inf_0014/post_00086,Nobis harum repellat modi dolorum nostrum tempore. #HKVitals #FCVJT,48586,1046,224
POST_00087,INF_0014,Twitter,2025-05-22,https://www.twitter.com/inf_0014/post_00087,Officiis nobis a in sunt ratione ab possimus consequuntur quod numquam deleniti eveniet quia. #Gritzo #ROPRS,7250,94,18
POST_00088,INF_0014,YouTube,2024-09-12,https://www.youtube.com/inf_0014/post_00088,Adipisci aliquam sapiente dolorem natus natus dolores laudantium fugiat eius ut perferendis consequuntur ut inventore. #HKVitals #AWOKD,53065,708,136
POST_00089,INF_0014,Instagram,2024-07-27,https://www.instagram.com/inf_0014/post_00089,Suscipit itaque exercitationem assumenda velit tempore eveniet corporis vero ad aut odit doloremque eos consequuntur aliquam. #HKVitals #KIJSU,48092,1325,81
POST_00090,INF_0015,Twitter,2025-04-10,https://www.twitter.com/inf_0015/post_00090,Libero maiores ullam quis eligendi nobis quaerat rem ea voluptas autem magnam. #MuscleBlaze #RHRML,43923,1029,73
POST_00091,INF_0015,YouTube,2025-02-23,https://www.youtube.com/inf_0015/post_00091,Nam quis asperiores quia repellat assumenda ut eum quia labore ut ut eveniet. #MuscleBlaze #HRMRB,59705,1869,100
POST_00092,INF_0015,YouTube,2025-04-05,https://www.youtube.com/inf_0015/post_00092,Numquam amet autem quam laboriosam laborum vero repellat porro aut vel rerum nihil tenetur soluta. #MuscleBlaze #TTHDM,64279,1056,157
POST_00093,INF_0015,Instagram,2025-07-11,https://www.instagram.com/inf_0015/post_00093,Facere porro hic repellat accusantium corporis ex perferendis aliquid tempore saepe molestias. #Gritzo #ORJKT,64998,2927,192
POST_00094,INF_0016,Twitter,2025-06-22,https://www.twitter.com/inf_0016/post_00094,Vel hic necessitatibus aliquam dolor laborum corporis nobis ullam consectetur mollitia perferendis. #HKVitals #OSKCA,280620,10957,1824
POST_00095,INF_0016,Twitter,2024-08-02,https://www.twitter.com/inf_0016/post_00095,Temporibus quasi exercitationem commodi aperiam maxime magni delectus minus voluptatem corrupti ad reiciendis necessitatibus. #HKVitals #CVGPN,331519,8453,948
POST_00096,INF_0016,YouTube,2024-12-20,https://www.youtube.com/inf_0016/post_00096,Laborum error labore labore dolorum vitae ullam magnam nam neque nemo porro hic eos aliquid. #MuscleBlaze #BQNFU,299497,16768,2885
POST_00097,INF_0016,Instagram,2025-07-08,https://www.instagram.com/inf_0016/post_00097,Sint quod molestias suscipit labore aperiam voluptatum debitis dolor aliquid quos ipsum. #MuscleBlaze #CGEDT,101814,8220,1384
POST_00098,INF_0016,YouTube,2025-03-12,https://www.youtube.com/inf_0016/post_00098,Hic sequi dicta odit voluptatem necessitatibus ad impedit distinctio at ducimus voluptatibus eius pariatur. #Gritzo #TLYOQ,495514,26038,4382
POST_00099,INF_0016,Instagram,2024-12-25,https://www.instagram.com/inf_0016/post_00099,Unde in architecto fugit quas qui veritatis impedit mollitia adipisci nemo quis voluptate quas consequuntur. #HKVitals #BLHHB,411504,19123,2553
POST_00100,INF_0016,Instagram,2024-10-05,https://www.instagram.com/inf_0016/post_00100,Cumque consectetur aliquid odio consequatur quia sapiente ducimus numquam at fugiat voluptate. #HKVitals #VBWWP,411311,22312,3426
POST_00101,INF_0017,YouTube,2024-12-02,https://www.youtube.com/inf_0017/post_00101,Eveniet consequuntur quidem odio debitis natus mollitia incidunt voluptas nisi explicabo ab laborum numquam placeat. #Gritzo #QIMDB,95726,3610,407
POST_00102,INF_0017,Twitter,2025-02-03,https://www.twitter.com/inf_0017/post_00102,Ab eligendi animi neque tempore voluptatibus ullam aliquam illo assumenda temporibus dolorum. #MuscleBlaze #NEGLL,331570,3906,462
POST_00103,INF_0018,YouTube,2025-02-11,https://www.youtube.com/inf_0018/post_00103,Magnam ratione corporis reiciendis libero suscipit delectus ipsa fuga voluptatem porro qui corporis. #HKVitals #URBQI,427621,12107,1465
POST_00104,INF_0018,YouTube,2025-03-25,https://www.youtube.com/inf_0018/post_00104,Eligendi modi commodi necessitatibus maxime impedit officia corporis. #Gritzo #WZPDC,787881,30254,3232
POST_00105,INF_0018,Twitter,2024-11-22,https://www.twitter.com/inf_0018/post_00105,Doloremque a quae veritatis occaecati corporis voluptate. #Gritzo #RDSCO,766175,11817,878
POST_00106,INF_0018,Twitter,2025-05-30,https://www.twitter.com/inf_0018/post_00106,Expedita cum quo eligendi porro tempore sed unde impedit ipsa. #Gritzo #ZXCRN,91593,1196,285
POST_00107,INF_0018,YouTube,2025-03-17,https://www.youtube.com/inf_0018/post_00107,Provident minima a adipisci voluptatibus beatae facere. #HKVitals #EZEHU,619660,16221,3108
POST_00108,INF_0018,Twitter,2025-05-11,https://www.twitter.com/inf_0018/post_00108,Harum aliquid iure voluptatibus eum aliquam tempora officia ratione. #MuscleBlaze #RWQPE,267035,5455,915
POST_00109,INF_0019,Twitter,2025-06-20,https://www.twitter.com/inf_0019/post_00109,Commodi illo fuga facere illum optio fuga numquam animi non commodi aspernatur deserunt esse mollitia. #HKVitals #BJSZP,223543,9190,854
POST_00110,INF_0019,Instagram,2025-05-27,https://www.instagram.com/inf_0019/post_00110,Deleniti voluptas ad iusto in reiciendis sint accusantium eos nisi similique accusantium hic eius. #HKVitals #ZUXFR,173878,8872,1758
POST_00111,INF_0019,YouTube,2024-12-29,https://www.youtube.com/inf_0019/post_00111,Adipisci cum nisi quod iusto magnam totam laborum ipsa pariatur itaque incidunt architecto accusantium quam. #Gritzo #NZVUD,86427,3635,803
POST_00112,INF_0019,Twitter,2024-08-05,https://www.twitter.com/inf_0019/post_00112,Pariatur delectus quae repellendus beatae quam eum molestiae doloribus assumenda ab officiis. #MuscleBlaze #SNDCE,140826,4122,872
POST_00113,INF_0020,Instagram,2024-10-24,https://www.instagram.com/inf_0020/post_00113,Quasi fugiat veritatis itaque illum laboriosam voluptatem distinctio repellendus. #HKVitals #XYKKJ,271962,7247,661
POST_00114,INF_0020,YouTube,2025-01-14,https://www.youtube.com/inf_0020/post_00114,Necessitatibus dolorem tenetur aperiam maiores iste voluptatibus aut sapiente dicta soluta accusamus nisi molestias distinctio. #MuscleBlaze #VQUDH,538377,17950,1368
POST_00115,INF_0020,Twitter,2024-07-31,https://www.twitter.com/inf_0020/post_00115,Aliquid quis at eveniet cum facilis tempore at facere molestiae tenetur nobis cumque porro dicta. #HKVitals #LACGV,369640,7901,1171
POST_00116,INF_0021,YouTube,2025-06-10,https://www.youtube.com/inf_0021/post_00116,Ipsa enim laboriosam quo voluptate aspernatur tenetur quidem. #MuscleBlaze #HBKUL,91212,3308,536
POST_00117,INF_0021,Instagram,2024-11-29,https://www.instagram.com/inf_0021/post_00117,Ad eius quasi nihil qui a ipsum provident tenetur mollitia nesciunt fuga veritatis. #Gritzo #NGDLP,157856,6152,1082
POST_00118,INF_0021,Instagram,2025-06-14,https://www.instagram.com/inf_0021/post_00118,Accusamus corporis velit necessitatibus eaque itaque expedita rem optio assumenda hic soluta tempore numquam eius. #Gritzo #ZBNNZ,318978,12490,1711
POST_00119,INF_0022,YouTube,2024-10-19,https://www.youtube.com/inf_0022/post_00119,Veritatis aut soluta sapiente placeat esse nobis cum voluptatum eum blanditiis. #HKVitals #TJBGR,216315,5873,1147
POST_00120,INF_0022,Instagram,2025-04-06,https://www.instagram.com/inf_0022/post_00120,Quam perspiciatis fugiat ut incidunt consequatur ullam laborum quidem ipsa. #MuscleBlaze #JIQVR,1330283,60053,5033
POST_00121,INF_0022,Instagram,2024-09-08,https://www.instagram.com/inf_0022/post_00121,Ea enim recusandae fugiat repellat ea nobis accusantium omnis fugit maxime sapiente unde sed. #MuscleBlaze #SYAFU,1209598,44567,4760
POST_00122,INF_0022,YouTube,2025-02-10,https://www.youtube.com/inf_0022/post_00122,Doloremque porro assumenda unde harum illum quo omnis sunt. #Gritzo #MAQHW,145375,4582,458
POST_00123,INF_0022,YouTube,2025-05-13,https://www.youtube.com/inf_0022/post_00123,Ad rerum accusamus veniam suscipit tenetur quibusdam ipsum corporis officiis sit accusantium magnam similique explicabo ut. #HKVitals #XTXKZ,714831,17356,4035
POST_00124,INF_0022,Twitter,2025-05-02,https://www.twitter.com/inf_0022/post_00124,Ad nam minus optio iusto enim nisi maiores doloribus temporibus quo sint molestias molestias praesentium. #HKVitals #USCPV,777405,11977,791
POST_00125,INF_0022,Twitter,2024-10-29,https://www.twitter.com/inf_0022/post_00125,Incidunt consequatur nihil molestiae blanditiis natus deleniti vero aliquid id eum asperiores minus. #HKVitals #HPLRJ,138455,3403,390
POST_00126,INF_0022,YouTube,2025-07-10,https://www.youtube.com/inf_0022/post_00126,Corrupti totam praesentium ipsa quae deleniti optio fuga quaerat repudiandae quia ipsam itaque nostrum ea incidunt. #HKVitals #QUBRK,736272,25565,2042
POST_00127,INF_0023,Instagram,2024-09-26,https://www.instagram.com/inf_0023/post_00127,Atque consequuntur dignissimos nesciunt consequatur incidunt blanditiis. #Gritzo #RLDGQ,143909,9857,572
