post_id,influencer_id,platform,date,URL,caption,reach,likes,comments
POST_00504,INF_0081,YouTube,2025-01-27,https://www.youtube.com/inf_0081/post_00504,Odio sit temporibus neque quod ipsa sed repellendus delectus. #HKVitals #FHCUU,405629,10867,617
POST_00505,INF_0081,YouTube,2024-11-29,https://www.youtube.com/inf_0081/post_00505,Illum nihil animi voluptates labore odit provident facilis laboriosam et beatae maiores. #Gritzo #EIMWI,163078,5808,402
POST_00506,INF_0081,Twitter,2025-01-19,https://www.twitter.com/inf_0081/post_00506,Vero error sit maxime eveniet corporis delectus accusamus error fuga tenetur ipsam repellendus. #Gritzo #ZFAKW,75537,1156,69
POST_00507,INF_0081,Twitter,2025-03-15,https://www.twitter.com/inf_0081/post_00507,Porro deserunt sit incidunt magni reiciendis et ipsam aliquam quaerat inventore et aliquid quam. #MuscleBlaze #IXCTT,36897,793,135
POST_00508,INF_0081,Instagram,2024-09-08,https://www.instagram.com/inf_0081/post_00508,Cupiditate illo deleniti dolorem exercitationem quisquam molestias quaerat officia odio. #HKVitals #FHNUR,140444,4307,310
POST_00509,INF_0082,Twitter,2025-05-22,https://www.twitter.com/inf_0082/post_00509,Sapiente enim ipsa amet nobis vel ipsa amet quis facere laborum hic quae. #MuscleBlaze #FJIDS,219152,3066,198
POST_00510,INF_0082,Twitter,2024-12-30,https://www.twitter.com/inf_0082/post_00510,Eveniet non quidem temporibus amet dolorem ab quos dolore cupiditate dolorum iusto animi consequatur nemo. #HKVitals #OBAXB,281987,2946,359
POST_00511,INF_0082,Twitter,2025-04-20,https://www.twitter.com/inf_0082/post_00511,Quas deserunt occaecati modi enim dolore rerum nisi exercitationem voluptate quam itaque. #Gritzo #XQRLJ,249879,2918,571
POST_00512,INF_0082,Twitter,2025-06-15,https://www.twitter.com/inf_0082/post_00512,Molestias beatae deserunt ullam deserunt eius ab vero voluptates cum ex sapiente ipsa ea enim at. #MuscleBlaze #ZTMDV,617722,10547,1415
POST_00513,INF_0082,Twitter,2024-12-04,https://www.twitter.com/inf_0082/post_00513,Reiciendis accusantium voluptas saepe vel tempora facere quibusdam odit animi provident. #Gritzo #SMGFW,428121,10781,1316
POST_00514,INF_0082,Twitter,2024-07-28,https://www.twitter.com/inf_0082/post_00514,Ipsam placeat placeat nihil fugiat minus quas. #Gritzo #IWIMB,112448,1811,389
POST_00515,INF_0082,YouTube,2025-07-19,https://www.youtube.com/inf_0082/post_00515,Placeat perferendis deleniti quas quasi error distinctio omnis minima ratione tenetur numquam. #HKVitals #PDCVU,245832,7046,1431
POST_00516,INF_0082,Twitter,2024-09-19,https://www.twitter.com/inf_0082/post_00516,Itaque inventore vel dolores excepturi reiciendis cupiditate nulla iusto quis dolores cum voluptatum accusamus. #HKVitals #KKQOZ,282122,3927,816
POST_00517,INF_0082,Twitter,2024-12-03,https://www.twitter.com/inf_0082/post_00517,Possimus aut praesentium earum odit corporis autem magnam suscipit. #HKVitals #ULUOG,456723,4278,1000
POST_00518,INF_0082,Twitter,2024-08-12,https://www.twitter.com/inf_0082/post_00518,Eum dicta exercitationem animi officia reprehenderit incidunt perferendis quasi repudiandae voluptate. #HKVitals #CPICL,234663,3657,594
POST_00519,INF_0083,YouTube,2024-11-01,https://www.youtube.com/inf_0083/post_00519,Iste sapiente dolores esse vero dolorem architecto saepe fugiat dolor. #HKVitals #QBFDP,1203699,39563,7736
POST_00520,INF_0083,Twitter,2025-07-01,https://www.twitter.com/inf_0083/post_00520,Laudantium ex reiciendis consequatur quia occaecati reprehenderit molestias dolor dolores id voluptates suscipit. #MuscleBlaze #LHQLF,1383065,18380,3741
POST_00521,INF_0083,Twitter,2025-04-17,https://www.twitter.com/inf_0083/post_00521,Eum odio vel unde officiis aperiam perspiciatis id quidem amet maiores omnis in mollitia. #HKVitals #XYSXZ,951341,18472,2676
POST_00522,INF_0083,Instagram,2025-04-17,https://www.instagram.com/inf_0083/post_00522,Voluptatibus blanditiis dignissimos sapiente earum hic neque nam accusamus. #HKVitals #BXZAO,1531424,42375,4310
POST_00523,INF_0083,Instagram,2025-07-16,https://www.instagram.com/inf_0083/post_00523,Neque earum minima laboriosam totam eum placeat ex sint cum maxime eaque recusandae delectus. #MuscleBlaze #LPQSK,735204,24157,1987
POST_00524,INF_0083,Instagram,2025-05-26,https://www.instagram.com/inf_0083/post_00524,Ab consectetur assumenda vero adipisci porro adipisci excepturi nisi. #MuscleBlaze #OVJKH,1376195,40816,2227
POST_00525,INF_0083,Twitter,2024-12-27,https://www.twitter.com/inf_0083/post_00525,Nostrum sint illo aliquid sint velit doloribus. #MuscleBlaze #DXRZD,298688,6405,1396
POST_00526,INF_0083,Twitter,2024-10-25,https://www.twitter.com/inf_0083/post_00526,Harum quod reprehenderit iure facilis nemo hic tempore quis provident soluta natus quisquam enim inventore fugiat. #Gritzo #YQLLV,661259,8507,1091
POST_00527,INF_0084,Twitter,2025-01-10,https://www.twitter.com/inf_0084/post_00527,Vero necessitatibus sapiente natus esse necessitatibus dolorum modi. #HKVitals #WGNKO,385616,17254,2697
POST_00528,INF_0084,Twitter,2025-05-21,https://www.twitter.com/inf_0084/post_00528,Quidem debitis inventore architecto occaecati odio dicta quis quo doloremque. #HKVitals #CMRDT,933943,40408,8090
POST_00529,INF_0085,Twitter,2025-06-08,https://www.twitter.com/inf_0085/post_00529,Magnam itaque occaecati sit impedit id suscipit beatae distinctio eveniet labore odit ipsa dolorum debitis. #MuscleBlaze #NPGQR,587893,21175,3188
POST_00530,INF_0085,Twitter,2025-04-25,https://www.twitter.com/inf_0085/post_00530,Totam sint vel quibusdam explicabo odit occaecati ullam natus. #HKVitals #PXNAL,777630,26315,2915
POST_00531,INF_0085,YouTube,2024-07-30,https://www.youtube.com/inf_0085/post_00531,Cum doloremque quos porro ut debitis vero. #HKVitals #HAXTS,503943,11191,1540
POST_00532,INF_0085,Instagram,2025-06-20,https://www.instagram.com/inf_0085/post_00532,Reiciendis laborum fuga blanditiis neque inventore laudantium unde ullam illum similique laboriosam voluptatem. #Gritzo #BZVQH,119257,6410,1385
POST_00533,INF_0085,YouTube,2025-02-09,https://www.youtube.com/inf_0085/post_00533,Temporibus numquam tempore nostrum placeat fuga in occaecati minus quod cumque a. #HKVitals #DHWAC,192888,8788,688
POST_00534,INF_0085,YouTube,2024-11-02,https://www.youtube.com/inf_0085/post_00534,Voluptatum quaerat placeat hic eligendi vero eos. #HKVitals #VGSMU,742422,26394,1764
POST_00535,INF_0085,Instagram,2025-07-14,https://www.instagram.com/inf_0085/post_00535,Inventore dolor iure porro fuga distinctio nulla accusantium adipisci numquam quia aliquid quos. #Gritzo #YEMZU,243520,12715,2167
POST_00536,INF_0085,Instagram,2025-01-27,https://www.instagram.com/inf_0085/post_00536,Molestias laudantium eligendi sed repellat est dicta corporis quisquam doloremque ex cum facere in cumque. #Gritzo #TIQTD,187281,9899,1041
POST_00537,INF_0085,Twitter,2025-01-07,https://www.twitter.com/inf_0085/post_00537,Adipisci dolores ipsa corporis laboriosam libero ex atque fugiat ipsam quasi commodi eum. #Gritzo #GRKGN,400838,9190,1876
POST_00538,INF_0086,Twitter,2025-03-26,https://www.twitter.com/inf_0086/post_00538,Consequatur animi eos asperiores odio dolor quidem ad culpa officia autem illo dolor facere fuga. #HKVitals #ZRBXQ,1420973,21510,4970
POST_00539,INF_0086,YouTube,2024-07-25,https://www.youtube.com/inf_0086/post_00539,Reiciendis architecto dolore eligendi laboriosam illo odit accusamus commodi vero. #HKVitals #HUGPL,1030749,19480,3458
POST_00540,INF_0086,Instagram,2025-02-21,https://www.instagram.com/inf_0086/post_00540,Harum saepe at aut nostrum est iure blanditiis consequuntur occaecati occaecati commodi odio eius. #Gritzo #IREOR,1248022,29881,2065
POST_00541,INF_0086,Instagram,2024-10-20,https://www.instagram.com/inf_0086/post_00541,Aut ipsum vitae dicta deserunt eos molestiae dicta consequatur quisquam harum odio. #Gritzo #LFHFA,220342,13495,2353
POST_00542,INF_0086,Instagram,2025-01-17,https://www.instagram.com/inf_0086/post_00542,Magni consequuntur eligendi culpa recusandae eum atque. #Gritzo #QSDWD,1004498,60824,9485
POST_00543,INF_0086,Instagram,2024-08-24,https://www.instagram.com/inf_0086/post_00543,Occaecati sit mollitia vel alias id cumque debitis. #MuscleBlaze #SGMYQ,1374450,47270,6085
POST_00544,INF_0086,Twitter,2024-10-11,https://www.twitter.com/inf_0086/post_00544,Cumque nemo quo aliquid placeat deserunt velit fugit velit animi voluptates doloribus quidem odio dolores saepe. #HKVitals #GUHBK,1476230,18538,3848
POST_00545,INF_0086,Instagram,2025-03-01,https://www.instagram.com/inf_0086/post_00545,Eos ut rerum earum fuga odit animi laborum omnis quod. #HKVitals #BZFKQ,243250,11205,1451
POST_00546,INF_0087,YouTube,2025-03-27,https://www.youtube.com/inf_0087/post_00546,Id soluta soluta consequatur amet harum dolores tenetur debitis corporis nulla modi ut commodi commodi officia. #Gritzo #GABSU,21517,549,95
POST_00547,INF_0087,Instagram,2025-04-25,https://www.instagram.com/inf_0087/post_00547,Ipsam neque aliquid eius sequi occaecati unde minima ducimus blanditiis minus mollitia natus. #MuscleBlaze #RGSXO,146597,9250,1304
POST_00548,INF_0087,YouTube,2025-07-21,https://www.youtube.com/inf_0087/post_00548,A unde laboriosam aliquam iste tempore similique nostrum deleniti voluptatem eius. #HKVitals #VUUOA,257108,8922,1243
POST_00549,INF_0088,YouTube,2024-11-22,https://www.youtube.com/inf_0088/post_00549,At amet aperiam necessitatibus impedit aliquid amet esse omnis temporibus delectus culpa commodi quaerat consequatur. #HKVitals #RKQYC,580750,23873,1579
POST_00550,INF_0088,YouTube,2025-05-25,https://www.youtube.com/inf_0088/post_00550,Non repellendus delectus neque delectus nesciunt molestiae voluptates totam. #HKVitals #QEBJE,736497,26393,4461
POST_00551,INF_0088,YouTube,2025-01-23,https://www.youtube.com/inf_0088/post_00551,Optio doloribus nemo cumque quae dolores similique optio quae facilis ipsam omnis consequatur nostrum saepe omnis. #HKVitals #CQTDF,759538,21832,3072
POST_00552,INF_0088,Instagram,2025-01-10,https://www.instagram.com/inf_0088/post_00552,Dicta exercitationem est eaque modi eos molestias distinctio sit facere possimus beatae fugiat soluta magni. #Gritzo #QMZVZ,80246,3029,338
POST_00553,INF_0088,Twitter,2024-08-16,https://www.twitter.com/inf_0088/post_00553,Dicta explicabo repellat adipisci est pariatur nihil soluta. #MuscleBlaze #KFRNY,904859,15736,3022
POST_00554,INF_0088,Instagram,2024-11-22,https://www.instagram.com/inf_0088/post_00554,Perferendis sapiente laudantium quam ducimus magnam porro alias voluptatibus architecto tempore omnis adipisci labore nemo. #MuscleBlaze #ADQMX,108625,6071,453
POST_00555,INF_0088,Instagram,2025-01-17,https://www.instagram.com/inf_0088/post_00555,Officia ullam fugiat sint soluta iusto accusamus sequi odit nemo. #Gritzo #BHULE,635239,39095,2760
POST_00556,INF_0088,YouTube,2024-10-04,https://www.youtube.com/inf_0088/post_00556,Eius quam maiores veniam commodi delectus delectus et quis. #Gritzo #UFULV,1013025,32280,3532
POST_00557,INF_0088,Twitter,2025-03-28,https://www.twitter.com/inf_0088/post_00557,Harum qui fugit necessitatibus reprehenderit non nihil. #Gritzo #OIZFB,231910,2375,237
POST_00558,INF_0088,YouTube,2025-05-30,https://www.youtube.com/inf_0088/post_00558,Ad incidunt corporis iste officiis cupiditate harum. #MuscleBlaze #SOLYB,160941,5583,922
POST_00559,INF_0089,Instagram,2024-09-06,https://www.instagram.com/inf_0089/post_00559,Libero consectetur neque officiis ex deleniti qui necessitatibus hic numquam deserunt deleniti ullam in voluptatibus. #HKVitals #CAYSP,451643,22401,4550
POST_00560,INF_0089,YouTube,2025-04-23,https://www.youtube.com/inf_0089/post_00560,Consectetur nam ipsam accusantium porro saepe iusto accusamus molestiae alias sequi dolorem illo esse nesciunt quibusdam. #Gritzo #DDHLG,310913,9566,1549
POST_00561,INF_0089,Twitter,2025-03-14,https://www.twitter.com/inf_0089/post_00561,Officiis eveniet a dicta tempore fugit iste dolores blanditiis. #HKVitals #PCVHK,804786,8932,2204
POST_00562,INF_0089,Instagram,2024-07-28,https://www.instagram.com/inf_0089/post_00562,Harum earum perspiciatis suscipit iure temporibus enim eos ipsum sint expedita ex soluta. #Gritzo #JTOFU,935764,33456,2871
POST_00563,INF_0090,Twitter,2025-03-12,https://www.twitter.com/inf_0090/post_00563,Molestiae deleniti facilis deserunt cumque consectetur eligendi et consectetur quidem quam provident exercitationem dignissimos hic itaque. #HKVitals #MEXBJ,46045,593,98
POST_00564,INF_0090,YouTube,2024-12-08,https://www.youtube.com/inf_0090/post_00564,Libero qui similique tenetur dolores dolores aut excepturi facere. #MuscleBlaze #CBNEA,96934,1519,141
POST_00565,INF_0090,YouTube,2025-05-05,https://www.youtube.com/inf_0090/post_00565,Voluptatibus nihil perspiciatis placeat reiciendis voluptates nesciunt rem. #Gritzo #PKTXF,29468,588,55
POST_00566,INF_0090,YouTube,2024-08-17,https://www.youtube.com/inf_0090/post_00566,Hic aspernatur repellat distinctio corporis consectetur sed quam rem ab ipsam laborum beatae. #MuscleBlaze #JFMMX,35270,1332,178
POST_00567,INF_0091,YouTube,2025-05-04,https://www.youtube.com/inf_0091/post_00567,Fuga hic facere amet quaerat sequi sequi fugiat eaque expedita modi assumenda maxime veritatis. #MuscleBlaze #LFJHI,16997,494,50
POST_00568,INF_0091,Instagram,2025-06-13,https://www.instagram.com/inf_0091/post_00568,Facere eum aliquam ex unde quasi numquam quia vitae necessitatibus eius. #HKVitals #LEIXP,147356,7196,1188
POST_00569,INF_0091,Instagram,2024-12-11,https://www.instagram.com/inf_0091/post_00569,Dicta iure dignissimos voluptate impedit qui error facere odio minima unde amet optio nostrum doloribus. #Gritzo #ZWCWM,182829,8227,1751
POST_00570,INF_0091,YouTube,2025-05-05,https://www.youtube.com/inf_0091/post_00570,Id illo facere id distinctio ad itaque sequi fugit dolorum delectus nihil veritatis. #MuscleBlaze #STGIP,164958,5012,390
POST_00571,INF_0091,Twitter,2024-07-24,https://www.twitter.com/inf_0091/post_00571,Modi cumque ullam cumque modi quo quos nisi vitae dolore. #MuscleBlaze #KBZTN,84737,1256,259
POST_00572,INF_0091,Twitter,2025-03-21,https://www.twitter.com/inf_0091/post_00572,Similique ut voluptate rerum deserunt similique consequuntur odio fuga. #MuscleBlaze #LGOAT,174959,2005,208
POST_00573,INF_0091,Twitter,2024-12-29,https://www.twitter.com/inf_0091/post_00573,Soluta praesentium distinctio consequuntur et aliquam quibusdam laudantium exercitationem occaecati tempora mollitia corrupti accusantium provident. #MuscleBlaze #ARELO,111922,2909,395
POST_00574,INF_0091,Instagram,2024-10-04,https://www.instagram.com/inf_0091/post_00574,Animi consequuntur at consequuntur incidunt corrupti occaecati fuga odit autem vitae. #Gritzo #KUJMQ,159547,3715,837
POST_00575,INF_0092,Twitter,2025-04-26,https://www.twitter.com/inf_0092/post_00575,Assumenda fugiat fuga rerum reprehenderit ducimus vitae quo. #MuscleBlaze #HTSPO,122370,2485,414
POST_00576,INF_0092,YouTube,2024-12-08,https://www.youtube.com/inf_0092/post_00576,Dolorum voluptates consequatur porro minus enim quibusdam iusto dicta. #Gritzo #YNXJB,200942,5493,326
POST_00577,INF_0092,YouTube,2024-12-23,https://www.youtube.com/inf_0092/post_00577,Quos blanditiis cumque numquam explicabo voluptatibus illo quod tempora dolores sapiente veniam. #MuscleBlaze #QSOUD,179478,4773,824
POST_00578,INF_0092,Twitter,2025-01-13,https://www.twitter.com/inf_0092/post_00578,Ex suscipit labore tempora deserunt sunt debitis commodi at veritatis perspiciatis autem eius excepturi quod. #Gritzo #WSTTI,431092,7671,981
POST_00579,INF_0092,Instagram,2024-07-30,https://www.instagram.com/inf_0092/post_00579,Harum nihil odit repellat pariatur debitis debitis voluptates cum quis fugit suscipit. #MuscleBlaze #JLNVM,267509,14449,3278
POST_00580,INF_0092,YouTube,2025-03-07,https://www.youtube.com/inf_0092/post_00580,Sint reprehenderit molestiae quam alias est odio beatae quos eum nesciunt tempore aspernatur. #Gritzo #JRSZW,113972,4434,298
POST_00581,INF_0092,YouTube,2024-09-30,https://www.youtube.com/inf_0092/post_00581,Amet cumque ipsum veniam est aperiam cumque reprehenderit. #MuscleBlaze #HYCHS,251610,9049,1329
POST_00582,INF_0093,YouTube,2025-07-02,https://www.youtube.com/inf_0093/post_00582,Nihil debitis velit tempore perferendis architecto eos quo illum doloremque impedit vero provident iure alias. #HKVitals #ZODJL,230463,5147,325
POST_00583,INF_0093,Instagram,2024-09-22,https://www.instagram.com/inf_0093/post_00583,Sit aperiam id sapiente architecto dolor expedita ipsa aut numquam veritatis nisi aspernatur vel autem delectus. #Gritzo #QKIQI,213834,10541,2255
POST_00584,INF_0094,YouTube,2024-11-17,https://www.youtube.com/inf_0094/post_00584,Deserunt quo tempore totam aperiam molestias ipsam quaerat dolor sunt aliquam. #HKVitals #OXHUF,174870,3403,731
POST_00585,INF_0094,Instagram,2025-02-22,https://www.instagram.com/inf_0094/post_00585,Ipsam nihil quidem fuga nulla inventore excepturi expedita eaque quos vero tempora illo unde. #HKVitals #HYQEN,99262,2828,523
POST_00586,INF_0094,Twitter,2025-01-27,https://www.twitter.com/inf_0094/post_00586,Atque commodi facere vitae vitae eveniet at eveniet. #MuscleBlaze #EDZOL,173981,2071,382
POST_00587,INF_0094,Twitter,2024-10-10,https://www.twitter.com/inf_0094/post_00587,Quaerat voluptates quos molestias praesentium atque distinctio accusantium sed et dicta earum praesentium qui. #HKVitals #ZDLZN,75023,638,149
POST_00588,INF_0094,Instagram,2024-08-10,https://www.instagram.com/inf_0094/post_00588,Ea magnam quia fuga dolore eaque suscipit delectus atque explicabo minima dolore. #HKVitals #YEZON,284657,9236,2087
POST_00589,INF_0094,Twitter,2024-09-03,https://www.twitter.com/inf_0094/post_00589,Aspernatur molestias eos quam nesciunt nostrum ducimus doloremque dolorem sequi optio culpa. #Gritzo #DOXLR,318308,8281,632
POST_00590,INF_0094,Twitter,2024-12-04,https://www.twitter.com/inf_0094/post_00590,Fuga officia explicabo vitae minima nemo possimus ratione veritatis eos. #MuscleBlaze #IKVLC,48525,955,152
POST_00591,INF_0094,Instagram,2024-09-22,https://www.instagram.com/inf_0094/post_00591,Neque quaerat aut illum reiciendis sit deserunt architecto ad dignissimos deserunt ducimus error ad a. #HKVitals #FCWRY,415677,16292,2297
POST_00592,INF_0094,Twitter,2025-05-01,https://www.twitter.com/inf_0094/post_00592,Soluta eveniet repudiandae quidem corrupti explicabo incidunt et voluptatibus sit nostrum facilis nostrum libero accusantium. #Gritzo #NBRKS,197094,3312,180
POST_00593,INF_0095,YouTube,2025-03-11,https://www.youtube.com/inf_0095/post_00593,Ducimus eveniet fugiat quaerat vitae sunt optio iure minima ex temporibus porro porro. #HKVitals #ZWCSL,1385730,73711,7584
POST_00594,INF_0095,Twitter,2025-06-08,https://www.twitter.com/inf_0095/post_00594,Nisi inventore numquam velit magnam similique voluptates ab ipsam reiciendis quos porro modi eaque. #HKVitals #SKVPD,483900,21961,3246
POST_00595,INF_0095,YouTube,2025-03-24,https://www.youtube.com/inf_0095/post_00595,A deleniti quibusdam harum doloribus necessitatibus reprehenderit iste dolore sed reiciendis maiores soluta odit mollitia. #MuscleBlaze #YPJAQ,444782,11897,1611
POST_00596,INF_0095,Twitter,2025-06-17,https://www.twitter.com/inf_0095/post_00596,Officia cumque quas sit commodi ut beatae culpa qui eligendi laudantium odio officiis quas placeat. #MuscleBlaze #FVHMV,482281,16045,2273
POST_00597,INF_0095,Twitter,2024-10-01,https://www.twitter.com/inf_0095/post_00597,Incidunt ipsum labore dolorum est sunt voluptatibus hic fugit consequatur laboriosam ipsa amet alias a. #HKVitals #FUEHQ,919963,17085,3012
POST_00598,INF_0095,YouTube,2025-03-03,https://www.youtube.com/inf_0095/post_00598,Dolores nostrum sint quaerat quasi veniam maiores nobis repellat sint. #HKVitals #EXQAT,732222,41682,6775
POST_00599,INF_0095,YouTube,2024-08-29,https://www.youtube.com/inf_0095/post_00599,Unde voluptate nemo esse sequi sunt tempora incidunt iusto. #Gritzo #MLGRZ,1157689,38215,7275
POST_00600,INF_0096,YouTube,2024-07-24,https://www.youtube.com/inf_0096/post_00600,Neque deserunt libero harum laboriosam id dolorem cum dolorum nisi ipsa. #MuscleBlaze #PDLSJ,145452,4817,819
POST_00601,INF_0096,YouTube,2025-04-10,https://www.youtube.com/inf_0096/post_00601,Distinctio asperiores accusamus aspernatur iusto facilis ducimus sit. #MuscleBlaze #HNYNT,304049,6810,1324
POST_00602,INF_0097,YouTube,2025-02-14,https://www.youtube.com/inf_0097/post_00602,Facilis quam earum unde unde iste quae aut. #HKVitals #VRHRR,113538,3040,638
POST_00603,INF_0097,Instagram,2024-12-13,https://www.instagram.com/inf_0097/post_00603,Consectetur facilis voluptas deleniti suscipit velit dignissimos. #MuscleBlaze #NJMIX,118138,3545,321
POST_00604,INF_0097,Instagram,2025-07-05,https://www.instagram.com/inf_0097/post_00604,Repudiandae deleniti quis dolore et suscipit atque sapiente voluptatem facere unde nam nihil dolores sunt expedita. #Gritzo #PVNNO,575009,15550,2101
POST_00605,INF_0097,Instagram,2024-09-10,https://www.instagram.com/inf_0097/post_00605,At facere illum nam recusandae a itaque molestias officia officiis. #MuscleBlaze #VYMIJ,617442,36912,5991
POST_00606,INF_0097,YouTube,2025-06-15,https://www.youtube.com/inf_0097/post_00606,Beatae magnam sapiente suscipit dolor alias nulla nisi. #MuscleBlaze #SAVFW,146045,2965,218
POST_00607,INF_0097,Instagram,2025-02-21,https://www.instagram.com/inf_0097/post_00607,Aperiam id earum molestiae blanditiis dolorum odio facilis. #MuscleBlaze #LTCAM,347891,11447,665
POST_00608,INF_0097,Twitter,2025-04-14,https://www.twitter.com/inf_0097/post_00608,Vel voluptas sequi cum eius dolorem deleniti vel. #Gritzo #PMXBH,53757,598,43
POST_00609,INF_0097,Twitter,2024-12-14,https://www.twitter.com/inf_0097/post_00609,Aperiam repellat deleniti quia deleniti possimus sequi. #MuscleBlaze #PFRAD,567946,7621,1209
POST_00610,INF_0097,YouTube,2025-04-22,https://www.youtube.com/inf_0097/post_00610,Unde facilis iure necessitatibus rerum eligendi aliquid. #MuscleBlaze #WUPNB,619222,20432,3034
POST_00611,INF_0097,Twitter,2025-02-11,https://www.twitter.com/inf_0097/post_00611,Molestias in fugiat eligendi ipsa nisi vel ex tempore similique nam alias ipsum. #MuscleBlaze #ZETAS,692337,16174,3494
POST_00612,INF_0098,YouTube,2025-04-16,https://www.youtube.com/inf_0098/post_00612,Dolor odio blanditiis incidunt blanditiis quas ipsum atque reprehenderit dolor quam molestias deleniti. #Gritzo #PLYEJ,80202,1574,144
POST_00613,INF_0098,Instagram,2025-07-03,https://www.instagram.com/inf_0098/post_00613,Possimus quae sapiente facere repellat eveniet atque perspiciatis sapiente ducimus ad quibusdam nam quae. #HKVitals #DCDTS,112104,2730,300
POST_00614,INF_0098,Instagram,2025-01-02,https://www.instagram.com/inf_0098/post_00614,Vero perferendis aliquam optio a quae temporibus animi veritatis. #HKVitals #HPIZL,111526,3623,785
POST_00615,INF_0098,Instagram,2025-04-19,https://www.instagram.com/inf_0098/post_00615,Laudantium rem ullam reiciendis nihil voluptatem temporibus. #MuscleBlaze #XUYJA,133135,6949,853
POST_00616,INF_0098,Twitter,2024-10-25,https://www.twitter.com/inf_0098/post_00616,Eveniet nam velit earum reiciendis veniam et quaerat architecto aspernatur nam eius. #Gritzo #RDKSZ,145225,3740,304
POST_00617,INF_0098,YouTube,2025-07-14,https://www.youtube.com/inf_0098/post_00617,Reprehenderit debitis error illo dolor ratione recusandae culpa cumque. #MuscleBlaze #IPZDV,142308,2802,521
POST_00618,INF_0098,Twitter,2025-02-19,https://www.twitter.com/inf_0098/post_00618,Excepturi vero numquam excepturi enim deserunt omnis quisquam id vel dolores. #Gritzo #HUQKM,120376,1910,267
POST_00619,INF_0098,YouTube,2025-04-16,https://www.youtube.com/inf_0098/post_00619,Odit rem illum nesciunt corporis minima at harum voluptatibus. #MuscleBlaze #TCGMQ,36171,613,37
POST_00620,INF_0098,Instagram,2025-05-04,https://www.instagram.com/inf_0098/post_00620,Voluptate ipsa provident nostrum autem debitis voluptate dolores iure unde consequuntur cupiditate iure veritatis. #HKVitals #RZJRD,123755,3463,226
POST_00621,INF_0099,YouTube,2024-10-17,https://www.youtube.com/inf_0099/post_00621,Ipsam occaecati odit animi reprehenderit cumque vero autem sapiente iusto veniam. #HKVitals #FRMGI,1219482,30905,7385
POST_00622,INF_0099,Instagram,2025-01-07,https://www.instagram.com/inf_0099/post_00622,Libero facere harum nostrum quis qui aliquam velit. #HKVitals #WDLWL,135131,3893,680
POST_00623,INF_0099,YouTube,2025-02-15,https://www.youtube.com/inf_0099/post_00623,Rem consequatur pariatur consequatur illum distinctio voluptate eveniet reprehenderit laborum molestiae earum. #Gritzo #ELIKT,836635,21553,3308
POST_00624,INF_0099,Twitter,2024-09-29,https://www.twitter.com/inf_0099/post_00624,Repellat repudiandae atque minus facere tenetur officia quo. #Gritzo #MOEBG,865847,12898,2302
POST_00625,INF_0099,YouTube,2024-10-08,https://www.youtube.com/inf_0099/post_00625,Quo nemo adipisci delectus aspernatur architecto ad perferendis alias dolores quos. #HKVitals #BPDJV,856529,27836,4674
POST_00626,INF_0099,YouTube,2024-12-06,https://www.youtube.com/inf_0099/post_00626,Modi vero architecto aspernatur omnis pariatur fugiat fuga aspernatur voluptatum voluptates cum sequi dolorem qui nemo. #MuscleBlaze #LZKBG,396632,9057,606
POST_00627,INF_0099,Twitter,2024-09-22,https://www.twitter.com/inf_0099/post_00627,Aperiam recusandae magni at doloribus delectus sint veritatis ipsa ullam debitis doloribus. #MuscleBlaze #WCENA,953684,15356,2238
POST_00628,INF_0099,YouTube,2025-03-25,https://www.youtube.com/inf_0099/post_00628,Expedita quas eaque aliquam modi fugit odio delectus. #HKVitals #AMAIO,512216,8053,1131
POST_00629,INF_0099,Twitter,2025-03-13,https://www.twitter.com/inf_0099/post_00629,Eligendi amet provident sequi repudiandae reiciendis omnis placeat iusto delectus nesciunt perspiciatis. #Gritzo #FMVRE,482069,13030,1137
POST_00630,INF_0099,Twitter,2024-09-23,https://www.twitter.com/inf_0099/post_00630,Minima accusamus omnis nulla commodi sed porro commodi neque adipisci. #MuscleBlaze #VNHBZ,617014,7512,1445
