post_id,influencer_id,platform,date,URL,caption,reach,likes,comments
POST_00253,INF_0045,Instagram,2024-12-20,https://www.instagram.com/inf_0045/post_00253,Quas ratione sint accusamus repudiandae eligendi harum nam. #HKVitals #UXRCT,53182,4453,243
POST_00254,INF_0045,Instagram,2025-07-11,https://www.instagram.com/inf_0045/post_00254,Totam minima assumenda molestiae commodi aperiam eius explicabo dolor quam explicabo minima. #HKVitals #JXEYA,668119,44901,7821
POST_00255,INF_0045,Instagram,2024-09-13,https://www.instagram.com/inf_0045/post_00255,Culpa dolores molestiae amet voluptatem quos error suscipit deserunt in. #HKVitals #GXIVO,142927,10269,631
POST_00256,INF_0045,Instagram,2024-08-22,https://www.instagram.com/inf_0045/post_00256,Saepe vel sint magni exercitationem fugiat aperiam ipsa necessitatibus veniam harum eius. #Gritzo #ZYBMH,700175,32645,5006
POST_00257,INF_0045,Instagram,2025-01-14,https://www.instagram.com/inf_0045/post_00257,Aliquam aliquam sapiente labore nihil rerum dicta natus. #HKVitals #FOHQM,505714,27237,5416
POST_00258,INF_0046,Twitter,2024-12-05,https://www.twitter.com/inf_0046/post_00258,Ab explicabo illum veniam error corrupti veritatis totam debitis cum fuga voluptates odit. #Gritzo #TGAKG,84969,1863,413
POST_00259,INF_0046,YouTube,2024-09-13,https://www.youtube.com/inf_0046/post_00259,Dolore repellat odit ducimus dolor occaecati ipsa molestiae quis corporis. #MuscleBlaze #TJTHF,215931,4802,1156
POST_00260,INF_0046,Instagram,2024-08-27,https://www.instagram.com/inf_0046/post_00260,Esse repellendus illo dolorum similique voluptatem quaerat dolorum in suscipit atque eligendi inventore soluta similique. #Gritzo #HBGVK,197926,7947,1538
POST_00261,INF_0046,Twitter,2025-03-03,https://www.twitter.com/inf_0046/post_00261,Repudiandae tempore excepturi suscipit laudantium expedita dolore optio. #MuscleBlaze #NQKPB,149972,1714,177
POST_00262,INF_0046,YouTube,2024-11-15,https://www.youtube.com/inf_0046/post_00262,Molestiae illo quasi facere nisi ea provident reiciendis esse. #HKVitals #STIHB,55409,1835,292
POST_00263,INF_0047,Instagram,2025-03-22,https://www.instagram.com/inf_0047/post_00263,Quidem porro harum quis beatae reprehenderit doloribus blanditiis numquam sed totam tempora. #MuscleBlaze #LIDJU,136632,5411,1170
POST_00264,INF_0047,Instagram,2025-06-27,https://www.instagram.com/inf_0047/post_00264,Quisquam possimus totam minima eum nam tenetur inventore consequuntur. #MuscleBlaze #UHSPF,243247,6650,1235
POST_00265,INF_0047,YouTube,2025-04-05,https://www.youtube.com/inf_0047/post_00265,Laudantium nulla laudantium iste minima omnis eos reprehenderit. #HKVitals #NRGZA,124110,2970,575
POST_00266,INF_0047,Instagram,2025-02-19,https://www.instagram.com/inf_0047/post_00266,Vero voluptatum cupiditate ex perspiciatis iste dolor ex non eaque. #MuscleBlaze #MUDAV,276443,7205,1512
POST_00267,INF_0048,Twitter,2024-12-16,https://www.twitter.com/inf_0048/post_00267,Sint sit laudantium similique nobis et occaecati sequi nobis sed voluptates ex accusamus laborum veritatis animi. #Gritzo #YCPXB,712007,8477,1459
POST_00268,INF_0048,Instagram,2024-08-14,https://www.instagram.com/inf_0048/post_00268,Est repudiandae perferendis voluptas saepe animi dicta aut iste provident reiciendis eligendi nesciunt quos. #MuscleBlaze #XVIBL,157052,6972,1460
POST_00269,INF_0048,YouTube,2024-11-06,https://www.youtube.com/inf_0048/post_00269,Maxime ea rerum tenetur id magni provident repellendus architecto. #HKVitals #AREFE,231922,9094,531
POST_00270,INF_0048,Twitter,2024-08-15,https://www.twitter.com/inf_0048/post_00270,Laborum accusamus et ad et dicta deserunt id velit. #Gritzo #GHKOB,231869,2719,236
POST_00271,INF_0048,Twitter,2025-04-15,https://www.twitter.com/inf_0048/post_00271,Tempore perspiciatis amet suscipit quae ipsum odit culpa maxime ullam nobis cupiditate laboriosam. #MuscleBlaze #QUUZU,284968,5223,730
POST_00272,INF_0048,Twitter,2025-04-22,https://www.twitter.com/inf_0048/post_00272,Exercitationem nam possimus maxime quisquam possimus ratione commodi perspiciatis perferendis ratione est aperiam voluptates. #Gritzo #IHAPA,587203,7601,1570
POST_00273,INF_0048,YouTube,2025-06-29,https://www.youtube.com/inf_0048/post_00273,Maxime at saepe assumenda dolores fuga sapiente maiores dicta perferendis ipsum suscipit. #Gritzo #JPGEG,206019,5311,1077
POST_00274,INF_0049,Instagram,2025-03-27,https://www.instagram.com/inf_0049/post_00274,Consequuntur dolorum corporis eum in non veniam cupiditate deleniti eveniet. #Gritzo #WUJVV,264329,11971,2468
POST_00275,INF_0049,Twitter,2024-08-15,https://www.twitter.com/inf_0049/post_00275,Facere eos quibusdam architecto accusantium hic quibusdam vitae tempora numquam. #HKVitals #XASYO,685710,7568,1870
POST_00276,INF_0050,Twitter,2024-08-30,https://www.twitter.com/inf_0050/post_00276,Sint quam ratione dicta quo minus quos voluptates. #HKVitals #EABPA,577455,8240,1365
POST_00277,INF_0050,Instagram,2024-10-07,https://www.instagram.com/inf_0050/post_00277,Dolorem nesciunt soluta necessitatibus nisi aliquid optio harum. #HKVitals #SXVIA,692617,40925,8154
POST_00278,INF_0050,Twitter,2024-10-22,https://www.twitter.com/inf_0050/post_00278,Adipisci neque eos asperiores molestias rerum hic explicabo repudiandae beatae unde quaerat beatae vero adipisci. #HKVitals #YJYKC,390619,4606,366
POST_00279,INF_0050,YouTube,2025-04-04,https://www.youtube.com/inf_0050/post_00279,Alias facilis velit optio accusantium praesentium quos debitis quam. #Gritzo #YQEZS,1055463,37349,3402
POST_00280,INF_0050,Twitter,2025-06-20,https://www.twitter.com/inf_0050/post_00280,Vero exercitationem dolor quaerat molestias harum explicabo saepe numquam enim. #MuscleBlaze #JTHEA,814966,14381,3105
POST_00281,INF_0050,Twitter,2025-01-27,https://www.twitter.com/inf_0050/post_00281,Rem molestias corrupti quisquam quo optio expedita iure ex. #MuscleBlaze #EIVPQ,181061,3248,359
POST_00282,INF_0050,Instagram,2024-12-15,https://www.instagram.com/inf_0050/post_00282,Id reiciendis dolorem eveniet aspernatur minus quam optio quas repellat animi porro. #MuscleBlaze #JIQZV,781056,43189,4818
POST_00283,INF_0050,Instagram,2024-08-25,https://www.instagram.com/inf_0050/post_00283,Minima officiis accusantium neque rerum rem deserunt pariatur nemo soluta commodi voluptate vel deleniti alias. #HKVitals #FSJUS,121728,5066,644
POST_00284,INF_0050,Instagram,2024-08-27,https://www.instagram.com/inf_0050/post_00284,Quasi quia veritatis velit beatae soluta facilis repudiandae sit quas aliquid autem voluptatum nesciunt officia voluptatibus. #HKVitals #MJOCM,986766,48094,8692
POST_00285,INF_0051,YouTube,2024-08-22,https://www.youtube.com/inf_0051/post_00285,Suscipit neque deleniti ex quo ab dignissimos quidem enim consectetur incidunt pariatur tenetur distinctio. #MuscleBlaze #UAAGC,334061,12878,1031
POST_00286,INF_0051,Instagram,2025-04-12,https://www.instagram.com/inf_0051/post_00286,Nesciunt temporibus accusantium eveniet sunt debitis laudantium. #Gritzo #YZIZX,630684,25021,4347
POST_00287,INF_0051,Twitter,2025-05-08,https://www.twitter.com/inf_0051/post_00287,Perspiciatis a excepturi unde eius architecto soluta voluptate quod excepturi consequuntur aperiam possimus. #HKVitals #ECFES,645023,14443,1424
POST_00288,INF_0051,YouTube,2025-05-04,https://www.youtube.com/inf_0051/post_00288,Odit qui omnis similique magni amet dolore cumque. #HKVitals #GBOVD,349617,8813,916
POST_00289,INF_0052,Instagram,2024-07-25,https://www.instagram.com/inf_0052/post_00289,Et vero repellendus id corrupti commodi eos. #MuscleBlaze #AEHCV,39172,2004,281
POST_00290,INF_0052,Twitter,2025-05-27,https://www.twitter.com/inf_0052/post_00290,Quibusdam blanditiis dolorum consequuntur repellendus exercitationem distinctio sunt nihil dolore atque repudiandae at. #HKVitals #COEXJ,53526,1258,171
POST_00291,INF_0052,Instagram,2025-03-16,https://www.instagram.com/inf_0052/post_00291,Possimus soluta repudiandae illum aliquam animi quis. #HKVitals #ODSCR,91381,4541,887
POST_00292,INF_0052,Instagram,2024-07-23,https://www.instagram.com/inf_0052/post_00292,Aspernatur sequi eligendi consequuntur dicta officiis iure ullam. #Gritzo #BKNZR,104770,6682,623
POST_00293,INF_0052,YouTube,2024-12-04,https://www.youtube.com/inf_0052/post_00293,Magnam inventore veniam quos distinctio repellendus maiores sit ex totam ea velit. #MuscleBlaze #KWAON,66657,4127,320
POST_00294,INF_0052,YouTube,2025-07-10,https://www.youtube.com/inf_0052/post_00294,Beatae iure neque quo eveniet accusantium suscipit. #MuscleBlaze #YEFFB,15149,742,64
POST_00295,INF_0052,Twitter,2024-11-01,https://www.twitter.com/inf_0052/post_00295,Laboriosam adipisci voluptatem animi explicabo minima deserunt assumenda tempora iste asperiores nulla. #MuscleBlaze #VGXXB,47502,1344,147
POST_00296,INF_0052,YouTube,2024-08-18,https://www.youtube.com/inf_0052/post_00296,Vitae dolor voluptatem quaerat est quod cupiditate nam eius rem molestiae iusto nisi enim vel. #Gritzo #LWUQN,50791,1940,150
POST_00297,INF_0052,Twitter,2024-09-14,https://www.twitter.com/inf_0052/post_00297,Laudantium explicabo error architecto exercitationem quis dolorem amet voluptate commodi dolores aspernatur. #Gritzo #TYYOC,36847,1200,135
POST_00298,INF_0053,YouTube,2024-09-03,https://www.youtube.com/inf_0053/post_00298,Nobis necessitatibus magni necessitatibus aliquam inventore similique nisi distinctio itaque minus reprehenderit natus fugiat explicabo fugit. #HKVitals #ROMEK,250464,11841,1467
POST_00299,INF_0053,YouTube,2024-09-29,https://www.youtube.com/inf_0053/post_00299,Voluptatibus minus harum blanditiis tenetur beatae velit qui iure dolorem earum veritatis impedit. #HKVitals #RBMGJ,147933,7779,832
POST_00300,INF_0053,YouTube,2025-03-05,https://www.youtube.com/inf_0053/post_00300,Voluptate illum ad ut repudiandae vitae ut illum ipsam dolores explicabo. #Gritzo #RZFHT,307433,9547,1809
POST_00301,INF_0053,Twitter,2025-01-17,https://www.twitter.com/inf_0053/post_00301,Blanditiis dicta recusandae voluptates repellendus delectus odit vel eaque voluptate odio tenetur enim. #Gritzo #CLXKM,213258,6141,381
POST_00302,INF_0053,Instagram,2025-05-02,https://www.instagram.com/inf_0053/post_00302,Consequatur pariatur neque perspiciatis aspernatur dolorem suscipit commodi tempora nesciunt iure. #MuscleBlaze #INDWW,34965,1299,275
POST_00303,INF_0053,Instagram,2025-07-14,https://www.instagram.com/inf_0053/post_00303,Accusantium voluptate accusantium quis dignissimos ipsa deserunt corrupti aliquid numquam repudiandae sunt rem culpa. #MuscleBlaze #ABJFJ,194138,9185,2133
POST_00304,INF_0053,Twitter,2024-07-29,https://www.twitter.com/inf_0053/post_00304,Provident id quaerat exercitationem veniam ducimus recusandae quibusdam excepturi quos et. #MuscleBlaze #GMLYM,225995,5505,1172
POST_00305,INF_0053,YouTube,2025-03-08,https://www.youtube.com/inf_0053/post_00305,Minus quaerat praesentium nobis nisi at ipsum nulla repellendus nihil iusto. #Gritzo #VCABW,309554,9123,827
POST_00306,INF_0054,Twitter,2025-06-28,https://www.twitter.com/inf_0054/post_00306,Quibusdam beatae qui error voluptatum distinctio repellendus mollitia vel hic laborum in quas iusto quo. #MuscleBlaze #GKAUT,84412,2032,350
POST_00307,INF_0054,Twitter,2025-02-17,https://www.twitter.com/inf_0054/post_00307,Ea odit quod nam temporibus sint ipsa ullam architecto facere. #MuscleBlaze #FPYSS,382094,8769,1895
POST_00308,INF_0054,YouTube,2025-04-23,https://www.youtube.com/inf_0054/post_00308,Similique dolores aliquid expedita quidem eum hic dolorem eveniet. #HKVitals #FHNQP,82680,2994,725
POST_00309,INF_0054,YouTube,2024-10-15,https://www.youtube.com/inf_0054/post_00309,Consectetur ducimus nam incidunt libero reprehenderit eaque quisquam. #Gritzo #QPHCB,1178558,33100,7227
POST_00310,INF_0054,YouTube,2025-01-25,https://www.youtube.com/inf_0054/post_00310,Corrupti optio et delectus eos odio occaecati qui libero deleniti minima non nisi laudantium asperiores atque. #Gritzo #SXHDT,1079501,35075,7201
POST_00311,INF_0055,Twitter,2025-03-24,https://www.twitter.com/inf_0055/post_00311,Esse maxime nemo omnis aliquam nulla eligendi perferendis sed facere provident deserunt rem necessitatibus iure. #HKVitals #RSRZG,692840,20349,1191
POST_00312,INF_0055,Twitter,2025-07-16,https://www.twitter.com/inf_0055/post_00312,Et nam officiis deleniti inventore cumque quos expedita voluptatem aut vel iste expedita. #Gritzo #VISRQ,774469,34999,4052
POST_00313,INF_0055,YouTube,2025-05-01,https://www.youtube.com/inf_0055/post_00313,Suscipit quos dolorum quia molestiae dignissimos voluptate nulla incidunt occaecati eos suscipit. #MuscleBlaze #VWECD,464506,22851,4497
POST_00314,INF_0055,Instagram,2025-07-11,https://www.instagram.com/inf_0055/post_00314,Incidunt eveniet vero harum optio dolorem nihil omnis hic odio. #Gritzo #XRFFW,695562,56071,6630
POST_00315,INF_0055,Twitter,2024-12-01,https://www.twitter.com/inf_0055/post_00315,Officia perspiciatis ipsa at non nisi provident dolores est facilis beatae eligendi dolorem incidunt ducimus. #HKVitals #MDBQP,981393,30750,2644
POST_00316,INF_0055,Instagram,2025-04-23,https://www.instagram.com/inf_0055/post_00316,Harum eius doloribus voluptas voluptate temporibus suscipit accusantium nisi. #Gritzo #JHBWD,381184,19477,3050
POST_00317,INF_0055,YouTube,2024-09-28,https://www.youtube.com/inf_0055/post_00317,Esse voluptas doloremque recusandae odio neque accusantium quis deserunt qui deserunt facere placeat provident earum illo. #MuscleBlaze #ISUMQ,347669,16850,899
POST_00318,INF_0055,YouTube,2025-06-07,https://www.youtube.com/inf_0055/post_00318,Vel velit nobis optio deleniti consectetur dolores reiciendis debitis accusantium voluptate eos. #MuscleBlaze #TETMT,220900,9472,1606
POST_00319,INF_0056,YouTube,2024-10-14,https://www.youtube.com/inf_0056/post_00319,Eaque voluptatibus laboriosam eveniet hic numquam ratione exercitationem eum debitis in consequuntur nam non tempore. #HKVitals #JAFJA,147034,5418,462
POST_00320,INF_0056,Twitter,2025-06-01,https://www.twitter.com/inf_0056/post_00320,Eum sed eius doloremque qui neque recusandae tenetur et nesciunt numquam cum beatae soluta consequuntur. #MuscleBlaze #QGSID,170226,3428,278
POST_00321,INF_0056,Instagram,2025-03-19,https://www.instagram.com/inf_0056/post_00321,Odio non quam voluptates inventore alias exercitationem quos deleniti ullam reiciendis autem necessitatibus nulla quidem. #HKVitals #YLNNL,284876,7227,1800
POST_00322,INF_0056,YouTube,2024-11-20,https://www.youtube.com/inf_0056/post_00322,Provident laboriosam maiores praesentium modi architecto nobis blanditiis vel possimus consequatur veritatis maxime porro corporis. #HKVitals #TEXVA,110022,4501,400
POST_00323,INF_0056,Instagram,2024-11-17,https://www.instagram.com/inf_0056/post_00323,Ratione harum sit repellat tempora veniam atque nesciunt. #Gritzo #NDSUJ,267310,14553,2437
POST_00324,INF_0056,Twitter,2025-06-29,https://www.twitter.com/inf_0056/post_00324,Aperiam unde sunt exercitationem impedit ducimus consequatur quo vero non. #MuscleBlaze #RQARK,168979,3111,428
POST_00325,INF_0056,Instagram,2025-07-13,https://www.instagram.com/inf_0056/post_00325,Est sapiente doloribus dolor eligendi consectetur tempore eaque quos labore fugit. #MuscleBlaze #SQHRR,127284,6540,496
POST_00326,INF_0056,Instagram,2025-07-14,https://www.instagram.com/inf_0056/post_00326,Ducimus quis asperiores delectus error soluta laborum consequuntur natus quo nam fuga nihil. #Gritzo #SDCCF,100731,3349,493
POST_00327,INF_0057,YouTube,2024-12-28,https://www.youtube.com/inf_0057/post_00327,Ducimus veniam reprehenderit tempora quibusdam eum beatae atque recusandae tempore labore est enim ducimus error ratione. #Gritzo #KEOXR,115956,2423,132
POST_00328,INF_0057,Instagram,2024-10-28,https://www.instagram.com/inf_0057/post_00328,Totam quasi laboriosam est eius quod sed laboriosam quo fuga iure. #MuscleBlaze #VRDCN,167417,4589,444
POST_00329,INF_0057,Instagram,2024-09-17,https://www.instagram.com/inf_0057/post_00329,Facere aut assumenda occaecati dicta saepe aliquam alias a nostrum recusandae ipsum eaque unde. #HKVitals #ZHMCE,22480,737,151
POST_00330,INF_0057,YouTube,2025-03-19,https://www.youtube.com/inf_0057/post_00330,Id dolorem magnam neque labore quibusdam vero neque saepe praesentium. #HKVitals #TCTBW,154661,2789,322
POST_00331,INF_0057,YouTube,2024-11-08,https://www.youtube.com/inf_0057/post_00331,Quia eius magni nemo pariatur et animi. #Gritzo #GTJIC,98920,2341,497
POST_00332,INF_0058,YouTube,2025-01-05,https://www.youtube.com/inf_0058/post_00332,Cumque at eius ex dolorem alias mollitia assumenda ullam harum perferendis incidunt laborum neque. #Gritzo #XEDSZ,351608,5180,1188
POST_00333,INF_0058,YouTube,2025-03-08,https://www.youtube.com/inf_0058/post_00333,Dolor eos aspernatur porro impedit mollitia corrupti quia eum iste recusandae pariatur quod repellat. #Gritzo #REJJA,289900,9360,2281
POST_00334,INF_0058,Instagram,2024-12-14,https://www.instagram.com/inf_0058/post_00334,Odit ab tenetur exercitationem iusto nobis laudantium voluptas tempora quia occaecati quae iure. #HKVitals #XCKBG,147010,7511,1343
POST_00335,INF_0058,Twitter,2024-08-10,https://www.twitter.com/inf_0058/post_00335,Veritatis nesciunt qui eos ab distinctio iste a illo expedita tempore asperiores provident. #Gritzo #SFYWN,291357,5768,748
POST_00336,INF_0058,Twitter,2024-08-27,https://www.twitter.com/inf_0058/post_00336,Modi qui nulla mollitia adipisci quidem ut nobis iusto dolorum provident. #MuscleBlaze #MRQDV,370022,7810,426
POST_00337,INF_0058,Instagram,2025-02-05,https://www.instagram.com/inf_0058/post_00337,Amet iusto occaecati excepturi odit dolores ut corrupti possimus enim rerum fugiat. #Gritzo #WWWBM,118702,8223,502
POST_00338,INF_0058,Instagram,2025-03-05,https://www.instagram.com/inf_0058/post_00338,Doloremque officia ex recusandae est deserunt saepe cum sapiente. #Gritzo #QKGLU,198674,11898,1577
POST_00339,INF_0058,Instagram,2024-12-20,https://www.instagram.com/inf_0058/post_00339,Necessitatibus sed natus quidem repellat rem voluptatum nobis corrupti voluptas omnis deleniti ratione. #HKVitals #TAKAO,344490,17923,4327
POST_00340,INF_0058,Twitter,2025-02-23,https://www.twitter.com/inf_0058/post_00340,Laboriosam quas placeat similique odit dolorum non. #HKVitals #XORLI,344260,7463,1601
POST_00341,INF_0059,Twitter,2024-12-27,https://www.twitter.com/inf_0059/post_00341,Non rem eligendi dicta tenetur porro commodi ipsum ad quibusdam animi impedit molestiae. #Gritzo #PSJLC,113341,1021,117
POST_00342,INF_0059,Twitter,2025-02-17,https://www.twitter.com/inf_0059/post_00342,Expedita sint repellendus fugit libero mollitia ullam labore perferendis non deserunt ullam tempore illum vero. #HKVitals #OJCXM,138792,3065,384
POST_00343,INF_0059,YouTube,2025-07-14,https://www.youtube.com/inf_0059/post_00343,Ipsa laborum reprehenderit unde adipisci doloribus pariatur aliquam corporis in libero doloribus. #Gritzo #FDWFV,40183,845,165
POST_00344,INF_0059,Instagram,2025-04-06,https://www.instagram.com/inf_0059/post_00344,Ut ipsum quia cum a recusandae alias voluptatum quod eos molestiae aliquam dolores animi quod delectus. #Gritzo #VPULR,159778,4438,632
POST_00345,INF_0059,Twitter,2024-08-16,https://www.twitter.com/inf_0059/post_00345,Quam fuga dicta ipsa ex laborum ullam molestias velit explicabo error exercitationem. #Gritzo #BYVMN,154307,1804,285
POST_00346,INF_0059,Twitter,2025-04-22,https://www.twitter.com/inf_0059/post_00346,Quam velit totam ex perspiciatis placeat amet reiciendis necessitatibus aliquam sequi quos quisquam asperiores voluptas odio. #MuscleBlaze #CRPIW,75812,1423,258
POST_00347,INF_0059,Instagram,2024-12-27,https://www.instagram.com/inf_0059/post_00347,Tenetur repellendus earum exercitationem ex similique eligendi sapiente necessitatibus odit at iure. #HKVitals #KIHUD,104533,6327,919
POST_00348,INF_0060,YouTube,2024-09-24,https://www.youtube.com/inf_0060/post_00348,Ducimus vero natus et veniam voluptates officiis ab. #Gritzo #TOFFS,489899,19427,1460
POST_00349,INF_0060,Twitter,2025-01-12,https://www.twitter.com/inf_0060/post_00349,Quos excepturi eos voluptatum atque illo dolorum. #Gritzo #ZEOQS,538132,9862,1570
POST_00350,INF_0060,Twitter,2024-11-10,https://www.twitter.com/inf_0060/post_00350,Rerum facere vero voluptas eligendi dolores dicta quaerat nam cumque harum quos. #Gritzo #KTVHW,569044,11013,626
POST_00351,INF_0060,Instagram,2025-06-27,https://www.instagram.com/inf_0060/post_00351,Numquam tempora optio praesentium nesciunt veritatis aperiam unde reprehenderit magnam quae provident. #MuscleBlaze #RFTEH,206311,11695,2121
POST_00352,INF_0060,YouTube,2024-10-02,https://www.youtube.com/inf_0060/post_00352,Quia labore unde adipisci amet corporis nam distinctio officiis adipisci nostrum dicta porro odio voluptas fugit. #MuscleBlaze #TAVCW,524291,18004,3463
POST_00353,INF_0060,Twitter,2025-05-09,https://www.twitter.com/inf_0060/post_00353,Voluptatem consequatur aut eveniet aliquid quod aliquam alias nisi eveniet quae officia hic autem. #HKVitals #GUUHR,645903,9247,2218
POST_00354,INF_0060,Twitter,2025-01-03,https://www.twitter.com/inf_0060/post_00354,Eius recusandae cumque repellat libero consequatur quo eius distinctio deleniti debitis. #HKVitals #ZBTFW,602953,10419,953
POST_00355,INF_0060,Twitter,2024-10-31,https://www.twitter.com/inf_0060/post_00355,Possimus sint vero aliquam aperiam consequatur itaque iusto repellat sunt. #Gritzo #SJPTF,514810,6303,837
POST_00356,INF_0060,Twitter,2025-03-06,https://www.twitter.com/inf_0060/post_00356,Nisi impedit eaque rem dignissimos fuga deleniti. #MuscleBlaze #EENJL,405345,4405,702
POST_00357,INF_0060,YouTube,2024-12-14,https://www.youtube.com/inf_0060/post_00357,Ut ullam animi ullam qui eius laborum neque ad minus soluta possimus nisi. #MuscleBlaze #ISEDI,76431,2817,467
POST_00358,INF_0061,YouTube,2025-07-13,https://www.youtube.com/inf_0061/post_00358,Laborum adipisci odit voluptatem nobis odio dolore beatae amet eveniet enim quisquam omnis tenetur expedita qui. #Gritzo #OBSNY,599078,32113,2562
POST_00359,INF_0061,Twitter,2024-09-03,https://www.twitter.com/inf_0061/post_00359,Ut delectus porro impedit vel dolor quibusdam libero quisquam voluptas maiores quod. #Gritzo #KJWRI,367482,15991,2662
POST_00360,INF_0061,YouTube,2024-12-12,https://www.youtube.com/inf_0061/post_00360,Mollitia error et consequuntur illum ut iusto molestias cumque accusamus doloribus non quaerat quibusdam soluta. #Gritzo #VZARL,990686,42541,7108
POST_00361,INF_0061,Instagram,2024-10-01,https://www.instagram.com/inf_0061/post_00361,Doloribus eveniet eaque amet quasi blanditiis iste voluptatum. #Gritzo #XJUCG,806536,24000,3507
POST_00362,INF_0061,YouTube,2025-03-22,https://www.youtube.com/inf_0061/post_00362,Ut quo dignissimos quod debitis recusandae fuga blanditiis. #Gritzo #ULBXF,592232,35697,2898
POST_00363,INF_0061,Twitter,2025-05-17,https://www.twitter.com/inf_0061/post_00363,Placeat totam iure labore quae repudiandae ex sed quos unde nemo deleniti deleniti reprehenderit. #Gritzo #ABRUW,500744,9202,1382
POST_00364,INF_0062,Twitter,2024-11-26,https://www.twitter.com/inf_0062/post_00364,Nemo dolores quis laudantium necessitatibus nobis beatae expedita veniam facere quam iure nisi. #MuscleBlaze #TDLIC,64993,2551,393
POST_00365,INF_0062,Twitter,2024-10-28,https://www.twitter.com/inf_0062/post_00365,Et tempora earum ea fugit inventore quia ad tempore fugit natus magnam. #MuscleBlaze #XKLKI,245157,5036,269
POST_00366,INF_0062,Twitter,2025-02-13,https://www.twitter.com/inf_0062/post_00366,Quam animi eveniet beatae libero voluptatum vero doloribus voluptatibus recusandae quisquam consequatur. #Gritzo #BTBWJ,306066,7167,1293
POST_00367,INF_0062,Twitter,2024-10-03,https://www.twitter.com/inf_0062/post_00367,Commodi nostrum enim facilis vitae ullam aperiam reprehenderit quisquam voluptatum. #MuscleBlaze #HYJVA,119840,2530,489
POST_00368,INF_0062,Twitter,2024-09-08,https://www.twitter.com/inf_0062/post_00368,Magnam dolore unde quo quas nesciunt inventore cupiditate sequi optio nisi dolores blanditiis reiciendis officia. #HKVitals #YDRXU,427786,10557,2515
POST_00369,INF_0062,Twitter,2025-05-05,https://www.twitter.com/inf_0062/post_00369,Perspiciatis saepe recusandae officia nesciunt sunt laudantium nihil id ducimus hic. #Gritzo #DBOKO,81577,1701,326
POST_00370,INF_0062,Twitter,2024-09-23,https://www.twitter.com/inf_0062/post_00370,Eligendi vitae id pariatur numquam cupiditate numquam nam rerum incidunt ut voluptatem accusantium corporis impedit dolore. #HKVitals #FXWDE,367358,9028,650
POST_00371,INF_0062,Twitter,2025-01-01,https://www.twitter.com/inf_0062/post_00371,Similique nihil sed facere doloribus libero commodi officia. #Gritzo #WWYZL,331232,8616,550
POST_00372,INF_0063,Instagram,2024-10-27,https://www.instagram.com/inf_0063/post_00372,Expedita dolorum quo animi repellendus mollitia illo magni ducimus mollitia officiis in quia ratione harum illo. #Gritzo #PYJRG,298067,7821,671
POST_00373,INF_0063,YouTube,2025-03-07,https://www.youtube.com/inf_0063/post_00373,Provident minus repellendus quidem eligendi ducimus excepturi. #HKVitals #IRSDO,740810,29977,2440
POST_00374,INF_0063,YouTube,2024-09-09,https://www.youtube.com/inf_0063/post_00374,Molestias distinctio asperiores rerum molestiae voluptate perferendis numquam id provident maiores quibusdam alias maiores placeat. #MuscleBlaze #USQHJ,632260,13848,1924
POST_00375,INF_0064,YouTube,2025-05-30,https://www.youtube.com/inf_0064/post_00375,Impedit nesciunt quis cupiditate possimus ex magni temporibus. #HKVitals #MCQCH,394632,15163,1308
POST_00376,INF_0064,Twitter,2025-01-15,https://www.twitter.com/inf_0064/post_00376,Odio deserunt nam inventore quisquam illo praesentium eum quisquam illum natus eius dolore totam praesentium. #Gritzo #BBANA,286573,4469,718
POST_00377,INF_0064,Instagram,2024-08-04,https://www.instagram.com/inf_0064/post_00377,In veniam excepturi perspiciatis ipsum eos expedita magni beatae aspernatur. #Gritzo #GXORD,202888,12161,1954
