post_id,influencer_id,platform,date,URL,caption,reach,likes,comments
POST_00128,INF_0023,Instagram,2024-11-20,https://www.instagram.com/inf_0023/post_00128,Consequuntur magni tempora iste doloribus beatae doloremque exercitationem impedit quidem recusandae eos laborum esse. #Gritzo #LJLBD,145520,5382,543
POST_00129,INF_0024,Instagram,2025-06-06,https://www.instagram.com/inf_0024/post_00129,Quae itaque aspernatur fugit ullam quisquam voluptatibus consectetur velit quos reprehenderit perferendis nostrum error. #Gritzo #ENXDU,608064,18645,3080
POST_00130,INF_0024,Twitter,2024-11-17,https://www.twitter.com/inf_0024/post_00130,Eum optio praesentium quasi unde quisquam quibusdam cumque enim eaque magnam. #HKVitals #FDBES,839410,17708,4293
POST_00131,INF_0024,YouTube,2025-02-27,https://www.youtube.com/inf_0024/post_00131,Laboriosam itaque eaque adipisci mollitia quaerat voluptatibus quisquam similique tempora amet ullam nihil. #Gritzo #JBOXW,614195,22469,3830
POST_00132,INF_0025,Twitter,2024-11-16,https://www.twitter.com/inf_0025/post_00132,Hic modi ipsa odit hic harum illo suscipit neque consectetur autem soluta odio corporis tempora. #MuscleBlaze #DFDUA,138642,1999,410
POST_00133,INF_0025,Twitter,2025-05-01,https://www.twitter.com/inf_0025/post_00133,A doloribus quos occaecati reiciendis praesentium nemo quasi corrupti rem numquam reiciendis libero. #MuscleBlaze #PCIZS,132315,2776,582
POST_00134,INF_0025,Instagram,2025-01-18,https://www.instagram.com/inf_0025/post_00134,Consequuntur beatae quasi velit sunt repellat nemo doloremque in natus qui esse numquam mollitia tempore. #MuscleBlaze #ZQLRI,211000,11535,1971
POST_00135,INF_0025,Instagram,2025-05-16,https://www.instagram.com/inf_0025/post_00135,Animi consequatur dicta ea voluptatem aspernatur eos ipsam accusantium. #MuscleBlaze #LXBDD,51670,1793,332
POST_00136,INF_0025,YouTube,2024-11-03,https://www.youtube.com/inf_0025/post_00136,Perferendis sequi nihil molestias cumque sit ad placeat sed nam. #Gritzo #XVGQO,42850,898,134
POST_00137,INF_0025,Twitter,2025-01-31,https://www.twitter.com/inf_0025/post_00137,Quas adipisci voluptate corrupti quaerat expedita similique reiciendis eos fuga voluptatibus asperiores expedita provident facilis. #Gritzo #EYERS,150060,3487,542
POST_00138,INF_0025,Instagram,2025-02-28,https://www.instagram.com/inf_0025/post_00138,Suscipit nesciunt delectus excepturi ex sapiente illum numquam. #MuscleBlaze #BQOQT,107944,5381,766
POST_00139,INF_0026,YouTube,2024-09-06,https://www.youtube.com/inf_0026/post_00139,Reprehenderit unde quod quaerat inventore atque vero debitis dolore voluptatum dignissimos qui ipsum quo excepturi corporis. #Gritzo #YMURH,164593,2444,320
POST_00140,INF_0026,YouTube,2025-06-25,https://www.youtube.com/inf_0026/post_00140,Recusandae molestias quibusdam dolor delectus deserunt quibusdam vero excepturi deleniti quidem quo officiis ducimus maiores. #HKVitals #FPIST,1093178,45017,3368
POST_00141,INF_0026,YouTube,2025-07-07,https://www.youtube.com/inf_0026/post_00141,Quod unde tempore soluta iure deleniti accusantium adipisci. #Gritzo #OIMGG,192692,4077,491
POST_00142,INF_0026,Twitter,2024-11-09,https://www.twitter.com/inf_0026/post_00142,Aspernatur quas maxime magni doloribus quam rem. #HKVitals #GWEIP,447177,9887,1409
POST_00143,INF_0026,Twitter,2024-07-29,https://www.twitter.com/inf_0026/post_00143,Laboriosam incidunt est rem provident officiis eius at ipsam quasi. #HKVitals #MIAYN,1218014,15628,1793
POST_00144,INF_0026,Instagram,2025-01-31,https://www.instagram.com/inf_0026/post_00144,Iusto asperiores eius nobis quisquam accusamus omnis fuga quos praesentium magnam cum. #HKVitals #MWRMN,1077142,40994,9143
POST_00145,INF_0026,Twitter,2024-09-27,https://www.twitter.com/inf_0026/post_00145,Sequi aut id repudiandae voluptatibus porro delectus similique odio aspernatur ipsam fugiat iure blanditiis. #HKVitals #TJKOF,730664,7329,1052
POST_00146,INF_0026,Twitter,2025-05-10,https://www.twitter.com/inf_0026/post_00146,Cumque impedit quasi eum temporibus facere nobis sint quibusdam soluta harum culpa corporis ea. #HKVitals #VQPDC,518469,13357,2060
POST_00147,INF_0026,YouTube,2024-09-21,https://www.youtube.com/inf_0026/post_00147,Perspiciatis deleniti dolores officiis neque impedit repudiandae harum non omnis iure quidem fugiat. #MuscleBlaze #FNNBD,471135,12131,1631
POST_00148,INF_0026,Twitter,2025-04-14,https://www.twitter.com/inf_0026/post_00148,Officia fugiat esse placeat blanditiis ab quasi enim iusto tempora veritatis excepturi dolorum facilis magnam. #Gritzo #DYIKQ,1071755,20488,2956
POST_00149,INF_0027,Twitter,2024-11-29,https://www.twitter.com/inf_0027/post_00149,Suscipit magni sunt id numquam placeat alias error ipsum quasi repudiandae expedita debitis. #HKVitals #SHVJR,661378,11905,2429
POST_00150,INF_0027,Twitter,2025-01-08,https://www.twitter.com/inf_0027/post_00150,Aut cum aperiam repellendus consectetur iusto soluta iure maxime dicta pariatur debitis laborum. #Gritzo #QPGRZ,407698,5590,342
POST_00151,INF_0027,YouTube,2024-12-27,https://www.youtube.com/inf_0027/post_00151,Enim voluptatum quas sit adipisci modi labore doloribus nulla quos sunt laudantium cumque a. #MuscleBlaze #NSUJV,195186,5307,973
POST_00152,INF_0027,Instagram,2024-12-14,https://www.instagram.com/inf_0027/post_00152,Laboriosam unde magni eum quae autem natus consectetur quaerat eum voluptatibus facere. #MuscleBlaze #LKKFN,428555,17129,3690
POST_00153,INF_0027,Twitter,2024-12-07,https://www.twitter.com/inf_0027/post_00153,Accusamus rerum fugit beatae asperiores illum quae illo ea dicta. #MuscleBlaze #SNOZM,280265,7194,971
POST_00154,INF_0027,Twitter,2024-08-19,https://www.twitter.com/inf_0027/post_00154,Quisquam totam optio porro exercitationem quisquam veritatis vel iusto. #HKVitals #ORWRU,209194,3320,797
POST_00155,INF_0027,YouTube,2024-10-04,https://www.youtube.com/inf_0027/post_00155,Ipsum alias minima pariatur iusto esse animi doloremque in. #Gritzo #HYZUS,478328,12461,1731
POST_00156,INF_0027,Twitter,2025-01-17,https://www.twitter.com/inf_0027/post_00156,Perspiciatis repellendus porro eaque quibusdam corrupti exercitationem repellat quod voluptatum magnam. #Gritzo #HDRJZ,559305,13494,2777
POST_00157,INF_0027,YouTube,2025-06-17,https://www.youtube.com/inf_0027/post_00157,Quos tempora delectus maxime adipisci quaerat adipisci unde officia commodi tempora eveniet eaque. #MuscleBlaze #HSJLG,344885,6314,949
POST_00158,INF_0027,Twitter,2025-03-22,https://www.twitter.com/inf_0027/post_00158,Possimus provident dignissimos voluptatum ullam nihil qui vero unde enim quo at. #Gritzo #HCTGB,614163,8157,756
POST_00159,INF_0028,YouTube,2024-11-29,https://www.youtube.com/inf_0028/post_00159,Debitis nemo voluptatibus vel sequi voluptatum et. #HKVitals #SCUAO,220389,4856,1140
POST_00160,INF_0028,YouTube,2024-12-08,https://www.youtube.com/inf_0028/post_00160,Et at provident saepe ex nihil ipsa magni minima inventore numquam asperiores quo repellendus architecto. #HKVitals #QTHHB,184894,5849,542
POST_00161,INF_0028,Twitter,2024-08-28,https://www.twitter.com/inf_0028/post_00161,Suscipit ipsum sed neque omnis consequatur repellendus eaque dolor ullam dolor tenetur labore maiores consequatur incidunt. #Gritzo #WAXKV,221456,1959,416
POST_00162,INF_0029,Instagram,2024-11-22,https://www.instagram.com/inf_0029/post_00162,Doloribus rem autem autem optio hic aliquam. #Gritzo #ZYWAO,13544,911,93
POST_00163,INF_0029,Twitter,2024-10-18,https://www.twitter.com/inf_0029/post_00163,Cupiditate delectus eveniet dicta atque quisquam impedit dolorem modi eligendi ea eligendi inventore impedit cumque inventore. #Gritzo #NXDNH,68162,952,180
POST_00164,INF_0029,Twitter,2024-09-12,https://www.twitter.com/inf_0029/post_00164,Hic nihil porro eveniet in esse illo ad dignissimos neque saepe officia quisquam harum beatae veritatis. #HKVitals #SAIHR,20229,384,65
POST_00165,INF_0029,YouTube,2024-11-23,https://www.youtube.com/inf_0029/post_00165,Beatae cum voluptatem culpa minima similique ullam ipsa sequi aperiam iusto blanditiis ex voluptas nulla. #HKVitals #NCRED,30385,621,60
POST_00166,INF_0029,Instagram,2025-06-23,https://www.instagram.com/inf_0029/post_00166,Voluptatem distinctio accusantium quam fugiat necessitatibus dolorum nemo id porro recusandae eos dolores. #HKVitals #TYHSA,56084,3146,198
POST_00167,INF_0029,Instagram,2025-04-20,https://www.instagram.com/inf_0029/post_00167,Temporibus reprehenderit maxime ullam incidunt qui voluptatum non commodi praesentium ad cupiditate laudantium eos aliquam sequi. #HKVitals #HKNXS,29402,738,169
POST_00168,INF_0029,YouTube,2024-10-31,https://www.youtube.com/inf_0029/post_00168,Neque numquam eum illum laborum animi commodi quae. #HKVitals #PFDDT,52351,1248,190
POST_00169,INF_0029,YouTube,2025-06-15,https://www.youtube.com/inf_0029/post_00169,Sequi minus praesentium saepe consequatur quibusdam dolores alias explicabo cum dolore enim tempora. #Gritzo #UVTRP,66493,1781,264
POST_00170,INF_0029,YouTube,2025-07-18,https://www.youtube.com/inf_0029/post_00170,Mollitia veritatis nostrum eligendi laudantium inventore id eveniet. #MuscleBlaze #XCVXF,46973,770,166
POST_00171,INF_0030,Instagram,2024-12-24,https://www.instagram.com/inf_0030/post_00171,Tenetur tempore voluptates eos officia quibusdam sunt accusamus cum quam deleniti blanditiis officia asperiores. #Gritzo #FPCNV,649906,29023,3902
POST_00172,INF_0030,Instagram,2024-09-04,https://www.instagram.com/inf_0030/post_00172,Ipsum illum quibusdam repellendus suscipit cupiditate quasi sint qui alias. #Gritzo #MUSKV,1015249,51629,3108
POST_00173,INF_0030,YouTube,2024-10-19,https://www.youtube.com/inf_0030/post_00173,Cupiditate modi porro quaerat molestias reprehenderit magni mollitia minus praesentium cumque illo deleniti eligendi. #Gritzo #BZYBY,122960,2798,554
POST_00174,INF_0030,Twitter,2024-11-17,https://www.twitter.com/inf_0030/post_00174,Quisquam optio deserunt pariatur exercitationem recusandae aliquid laboriosam officiis corrupti consequatur praesentium aliquid minima aliquam velit. #Gritzo #QKZJW,1216386,18056,3246
POST_00175,INF_0030,Twitter,2025-01-02,https://www.twitter.com/inf_0030/post_00175,Error asperiores consequuntur consequuntur ipsum aliquid sit itaque debitis. #Gritzo #DWDZK,242436,5913,1256
POST_00176,INF_0030,Instagram,2025-02-07,https://www.instagram.com/inf_0030/post_00176,Perferendis expedita dignissimos saepe minus amet quibusdam laborum fuga nostrum. #HKVitals #MSLJF,658894,19893,1689
POST_00177,INF_0030,Twitter,2024-10-01,https://www.twitter.com/inf_0030/post_00177,Iste illum optio nisi quo suscipit vel harum deleniti sapiente explicabo. #MuscleBlaze #ARPYX,384037,3751,606
POST_00178,INF_0030,YouTube,2024-09-22,https://www.youtube.com/inf_0030/post_00178,Dignissimos amet enim nulla nisi saepe asperiores at officia nam. #Gritzo #RWGBL,757779,23771,4745
POST_00179,INF_0030,Instagram,2025-03-15,https://www.instagram.com/inf_0030/post_00179,Sequi iure quasi aliquam expedita libero totam expedita. #Gritzo #ZGXOP,1048655,63214,5912
POST_00180,INF_0031,Twitter,2024-09-15,https://www.twitter.com/inf_0031/post_00180,Quae illo reprehenderit sequi sed consequatur magnam libero quam nemo tempore dolorum ipsa. #Gritzo #FHBYW,595688,11884,1530
POST_00181,INF_0031,YouTube,2025-04-18,https://www.youtube.com/inf_0031/post_00181,Animi minus odio deleniti animi quam nisi minus facilis iusto modi adipisci aliquid alias in eligendi. #MuscleBlaze #ZYRUI,294110,5119,609
POST_00182,INF_0031,Twitter,2025-06-03,https://www.twitter.com/inf_0031/post_00182,Officia ad quidem voluptas eos minima repellendus sequi architecto assumenda mollitia adipisci nesciunt id. #HKVitals #GFWDM,75685,1226,155
POST_00183,INF_0031,Twitter,2024-09-28,https://www.twitter.com/inf_0031/post_00183,Praesentium architecto temporibus neque error aut ducimus repellat blanditiis reiciendis omnis alias sed repellat maiores. #MuscleBlaze #KGICL,266558,4559,962
POST_00184,INF_0032,YouTube,2025-05-31,https://www.youtube.com/inf_0032/post_00184,Iure repudiandae quibusdam minus libero repellendus quam officiis cumque asperiores nobis. #HKVitals #RPWET,661232,18444,2560
POST_00185,INF_0032,YouTube,2024-11-03,https://www.youtube.com/inf_0032/post_00185,Voluptate minus optio quis quos reiciendis occaecati quae sunt molestias natus ratione quidem molestias. #HKVitals #YAYZD,891348,23915,2261
POST_00186,INF_0033,YouTube,2024-11-28,https://www.youtube.com/inf_0033/post_00186,Minus ad eveniet quas deserunt repellat corporis sequi animi tempora iure minima vitae nesciunt nihil. #MuscleBlaze #OUJNJ,7157,190,27
POST_00187,INF_0033,Instagram,2024-10-18,https://www.instagram.com/inf_0033/post_00187,Explicabo laborum doloribus rerum expedita provident nesciunt dolore amet occaecati aliquid aut possimus nostrum placeat. #Gritzo #MVXJK,13721,459,35
POST_00188,INF_0033,YouTube,2025-01-15,https://www.youtube.com/inf_0033/post_00188,Exercitationem aliquid recusandae quae ab nesciunt voluptatum maxime dolore alias ipsam. #Gritzo #YPKDI,9737,341,48
POST_00189,INF_0033,Twitter,2024-10-22,https://www.twitter.com/inf_0033/post_00189,Quidem explicabo cum ex ab quo fugit minima at accusantium sint aperiam nesciunt. #Gritzo #ITMST,11503,254,29
POST_00190,INF_0033,Instagram,2024-12-26,https://www.instagram.com/inf_0033/post_00190,Commodi blanditiis cumque aut natus ipsum animi doloremque quos voluptate dicta laudantium sunt itaque consequatur. #Gritzo #OEXZY,12879,810,52
POST_00191,INF_0034,Instagram,2025-06-29,https://www.instagram.com/inf_0034/post_00191,Sit error voluptatum quaerat veniam eveniet cupiditate molestias beatae eius a totam. #HKVitals #DQBDF,443402,13800,2352
POST_00192,INF_0034,Twitter,2024-09-26,https://www.twitter.com/inf_0034/post_00192,Nisi magni ipsum quod voluptates tempore quos vero molestiae voluptate laboriosam odio dignissimos. #HKVitals #RANKA,669213,22003,2256
POST_00193,INF_0035,Twitter,2025-04-12,https://www.twitter.com/inf_0035/post_00193,Repellendus recusandae illo consequuntur incidunt molestiae magnam asperiores eum commodi repellat voluptatum. #Gritzo #LYEXN,211522,4321,416
POST_00194,INF_0035,YouTube,2024-11-13,https://www.youtube.com/inf_0035/post_00194,Repellendus eum quis excepturi reprehenderit ipsam repudiandae atque impedit. #HKVitals #UCYLG,525241,10410,2195
POST_00195,INF_0035,Instagram,2025-07-11,https://www.instagram.com/inf_0035/post_00195,Voluptate facilis quidem enim voluptate tenetur veritatis sunt itaque. #Gritzo #ZQAKJ,373128,17911,3296
POST_00196,INF_0035,Instagram,2025-01-10,https://www.instagram.com/inf_0035/post_00196,Nisi quis maiores quisquam amet eos beatae in fugit odit iure velit autem amet possimus necessitatibus. #HKVitals #VQIZZ,661075,42946,3962
POST_00197,INF_0035,Twitter,2025-01-22,https://www.twitter.com/inf_0035/post_00197,Ex animi neque dignissimos sit non assumenda veritatis dignissimos similique impedit. #Gritzo #MBBYX,433294,3744,874
POST_00198,INF_0035,YouTube,2024-10-18,https://www.youtube.com/inf_0035/post_00198,Dolor iusto iste sit eaque magnam consectetur. #MuscleBlaze #YPTSK,98738,1794,168
POST_00199,INF_0035,YouTube,2025-05-26,https://www.youtube.com/inf_0035/post_00199,Sit fugiat quidem blanditiis facere cumque amet ipsum maiores provident eligendi odio. #Gritzo #XITDZ,543755,13123,3202
POST_00200,INF_0035,Instagram,2025-01-02,https://www.instagram.com/inf_0035/post_00200,Autem a velit minus veniam voluptate accusantium quidem cupiditate. #MuscleBlaze #LVITY,318601,19183,1104
POST_00201,INF_0035,YouTube,2024-11-15,https://www.youtube.com/inf_0035/post_00201,Magni rem deserunt illum placeat commodi consectetur excepturi harum debitis iure assumenda sint expedita temporibus blanditiis. #HKVitals #MJYLR,500100,7533,1254
POST_00202,INF_0035,Instagram,2025-02-03,https://www.instagram.com/inf_0035/post_00202,Expedita dolorem voluptate quas tempore rerum incidunt optio numquam necessitatibus corrupti totam nobis. #Gritzo #BGJUE,313733,12641,860
POST_00203,INF_0036,YouTube,2025-02-12,https://www.youtube.com/inf_0036/post_00203,Aliquid ex soluta reprehenderit pariatur vero aut. #HKVitals #TCCLO,659894,11186,757
POST_00204,INF_0036,Twitter,2025-06-07,https://www.twitter.com/inf_0036/post_00204,Itaque doloremque consectetur dolore aut nesciunt soluta cupiditate culpa nulla facere delectus expedita commodi. #MuscleBlaze #PUWAK,963831,20448,3162
POST_00205,INF_0036,Instagram,2025-04-29,https://www.instagram.com/inf_0036/post_00205,Quaerat aperiam blanditiis accusantium laborum enim officiis a. #Gritzo #NREGG,242259,7343,738
POST_00206,INF_0036,YouTube,2024-12-11,https://www.youtube.com/inf_0036/post_00206,Modi deserunt a dolore porro vitae sit illum. #HKVitals #UJYSM,778662,20802,1573
POST_00207,INF_0036,Instagram,2024-07-23,https://www.instagram.com/inf_0036/post_00207,Neque sapiente fugiat accusantium provident nemo voluptatibus vitae sed quis voluptates animi eos. #HKVitals #IQUII,1005202,54928,13401
POST_00208,INF_0036,Instagram,2024-11-06,https://www.instagram.com/inf_0036/post_00208,Provident neque minima neque quia doloribus enim ex libero. #HKVitals #IYFIZ,1179831,39487,7201
POST_00209,INF_0037,Twitter,2025-07-10,https://www.twitter.com/inf_0037/post_00209,Repellat porro perspiciatis sapiente aut eligendi laborum quaerat. #MuscleBlaze #IHUJY,320349,8854,738
POST_00210,INF_0037,Twitter,2025-02-28,https://www.twitter.com/inf_0037/post_00210,Dicta provident vel minima corporis id odit in. #MuscleBlaze #YMSLH,913082,20008,4078
POST_00211,INF_0037,YouTube,2024-07-26,https://www.youtube.com/inf_0037/post_00211,Eligendi dignissimos deleniti officia pariatur voluptates nihil rem quod fuga fuga aliquam similique delectus ratione. #Gritzo #MQGRS,1028785,14196,3518
POST_00212,INF_0037,YouTube,2025-07-09,https://www.youtube.com/inf_0037/post_00212,Illum illum veniam perspiciatis dolorem non amet optio placeat eius deserunt. #Gritzo #KNXRO,1030762,21680,4899
POST_00213,INF_0037,Twitter,2025-05-14,https://www.twitter.com/inf_0037/post_00213,Est debitis optio dolore laborum consectetur atque provident blanditiis ea neque fugit tenetur error. #Gritzo #QCTRJ,857978,7495,1844
POST_00214,INF_0037,Twitter,2025-05-11,https://www.twitter.com/inf_0037/post_00214,Perspiciatis ut magnam sapiente consequatur vitae odit est occaecati illo. #Gritzo #KTZLA,391206,6897,1010
POST_00215,INF_0037,Twitter,2025-03-14,https://www.twitter.com/inf_0037/post_00215,Nulla rem nulla veritatis labore sapiente distinctio necessitatibus dignissimos pariatur architecto nisi laudantium labore. #Gritzo #OLKUP,681813,10904,618
POST_00216,INF_0037,Instagram,2025-02-20,https://www.instagram.com/inf_0037/post_00216,Tenetur itaque quam omnis dignissimos nobis minus hic perferendis soluta optio commodi necessitatibus. #HKVitals #KZDYD,455105,19977,1761
POST_00217,INF_0037,YouTube,2025-06-08,https://www.youtube.com/inf_0037/post_00217,Ad quasi quisquam consequuntur assumenda voluptate sit modi. #HKVitals #MLSIH,1054163,16002,3450
POST_00218,INF_0038,Twitter,2024-09-03,https://www.twitter.com/inf_0038/post_00218,Quae veritatis fugiat ipsam voluptates ad exercitationem. #MuscleBlaze #YTNOI,676917,10815,2209
POST_00219,INF_0038,Twitter,2024-09-10,https://www.twitter.com/inf_0038/post_00219,Accusamus debitis architecto soluta quibusdam sunt laudantium. #MuscleBlaze #ERKTW,708777,12509,667
POST_00220,INF_0038,Instagram,2024-09-18,https://www.instagram.com/inf_0038/post_00220,Soluta deleniti dolor similique quaerat omnis magni quaerat exercitationem molestias eum odio accusantium dolor recusandae. #MuscleBlaze #HSUPU,828655,33018,2854
POST_00221,INF_0039,YouTube,2024-10-28,https://www.youtube.com/inf_0039/post_00221,Voluptates repellendus provident nulla veritatis rem tempora consequatur beatae odit suscipit totam dignissimos. #Gritzo #WNQPP,524397,10981,2358
POST_00222,INF_0039,Twitter,2024-12-06,https://www.twitter.com/inf_0039/post_00222,Hic veritatis ducimus voluptas distinctio natus cum quam placeat enim. #MuscleBlaze #VSHPC,160939,1798,190
POST_00223,INF_0039,Instagram,2024-08-19,https://www.instagram.com/inf_0039/post_00223,Assumenda illo ullam accusamus veritatis aut fuga nihil rerum. #HKVitals #SNKDJ,202500,9726,1770
POST_00224,INF_0040,Twitter,2024-09-20,https://www.twitter.com/inf_0040/post_00224,Magni quia consequatur libero vel odit atque omnis sequi a nostrum dolor repellendus. #MuscleBlaze #MDILB,512156,4852,367
POST_00225,INF_0040,YouTube,2025-01-06,https://www.youtube.com/inf_0040/post_00225,Ipsa soluta magni animi saepe maxime ratione quo sunt dignissimos consequatur velit magnam necessitatibus unde eos. #Gritzo #NMRKV,668147,11041,638
POST_00226,INF_0040,Instagram,2025-04-28,https://www.instagram.com/inf_0040/post_00226,Vel facere odio ratione ex rem exercitationem totam inventore aperiam. #HKVitals #AFHUO,1009638,43883,6362
POST_00227,INF_0040,Twitter,2025-03-05,https://www.twitter.com/inf_0040/post_00227,Doloremque saepe eveniet porro eum dolores dolorem deserunt cupiditate vero perferendis esse. #MuscleBlaze #GOZOT,994547,17175,1549
POST_00228,INF_0041,Instagram,2024-09-21,https://www.instagram.com/inf_0041/post_00228,Atque deleniti mollitia laborum ipsam impedit maiores quod. #Gritzo #VTHZL,604018,35159,4607
POST_00229,INF_0041,Instagram,2025-06-01,https://www.instagram.com/inf_0041/post_00229,Iure distinctio sed nobis nemo pariatur nostrum. #MuscleBlaze #FTRWP,719791,33432,6737
POST_00230,INF_0041,Instagram,2025-02-26,https://www.instagram.com/inf_0041/post_00230,Veritatis quod soluta veritatis beatae enim delectus placeat enim ipsum. #MuscleBlaze #ONPEZ,522644,22626,5406
POST_00231,INF_0041,Twitter,2024-11-09,https://www.twitter.com/inf_0041/post_00231,Est natus distinctio fugiat nisi nobis facere dignissimos assumenda accusantium fugit. #Gritzo #VDTKB,500372,9772,1795
POST_00232,INF_0041,Instagram,2024-11-12,https://www.instagram.com/inf_0041/post_00232,Consequatur temporibus laborum asperiores dignissimos impedit officia veritatis. #MuscleBlaze #DIGVK,303778,14720,2479
POST_00233,INF_0041,YouTube,2025-02-12,https://www.youtube.com/inf_0041/post_00233,Ipsum sunt sunt deserunt odit dolorem nesciunt. #HKVitals #BUTKT,1107499,40352,5409
POST_00234,INF_0041,YouTube,2024-09-10,https://www.youtube.com/inf_0041/post_00234,Repellat iusto incidunt tempora facere quam aliquid optio distinctio repellendus at velit dolor quasi sequi. #HKVitals #PWWCZ,1020421,30146,6506
POST_00235,INF_0041,Twitter,2024-10-06,https://www.twitter.com/inf_0041/post_00235,Dolores voluptatem unde voluptatem possimus libero occaecati odit repellat. #HKVitals #FLFGV,588277,10971,1711
POST_00236,INF_0042,YouTube,2024-12-26,https://www.youtube.com/inf_0042/post_00236,Quae culpa debitis iure aperiam dolor molestiae voluptatibus mollitia cum. #Gritzo #TBQVA,769247,20078,2698
POST_00237,INF_0042,YouTube,2024-11-13,https://www.youtube.com/inf_0042/post_00237,Fuga laudantium sapiente incidunt ipsam placeat sunt beatae ex nisi dolore. #MuscleBlaze #ZXWHW,728443,17426,2023
POST_00238,INF_0042,Instagram,2025-06-15,https://www.instagram.com/inf_0042/post_00238,Repudiandae ad nulla soluta natus harum ex aspernatur voluptates eius eius sequi. #HKVitals #RQBQS,634719,35896,2441
POST_00239,INF_0042,Instagram,2024-08-07,https://www.instagram.com/inf_0042/post_00239,Animi placeat minima nobis quae distinctio assumenda impedit ea corporis. #MuscleBlaze #FCPNL,57710,2949,215
POST_00240,INF_0042,YouTube,2025-05-10,https://www.youtube.com/inf_0042/post_00240,Harum dicta doloremque suscipit consequuntur hic expedita repudiandae in. #Gritzo #DBJSC,293472,16951,1286
POST_00241,INF_0042,Instagram,2024-11-06,https://www.instagram.com/inf_0042/post_00241,Est hic dolore ratione accusamus beatae modi ipsa sunt accusamus officiis unde nesciunt. #Gritzo #ZDNAQ,391355,26612,4484
POST_00242,INF_0042,Instagram,2024-11-13,https://www.instagram.com/inf_0042/post_00242,Qui quam dignissimos iste unde autem soluta ex unde corporis tenetur eligendi blanditiis dolorum odit doloribus. #HKVitals #QLFXD,146593,10517,1203
POST_00243,INF_0042,YouTube,2025-01-12,https://www.youtube.com/inf_0042/post_00243,Dicta magni sed nisi non eveniet libero autem cupiditate aliquid quasi. #HKVitals #UGQGP,608422,17382,4108
POST_00244,INF_0042,Instagram,2025-06-17,https://www.instagram.com/inf_0042/post_00244,Ad magnam laborum reiciendis consequuntur quae laudantium non accusamus a error unde. #Gritzo #WFPEK,550495,38171,7766
POST_00245,INF_0043,YouTube,2025-01-03,https://www.youtube.com/inf_0043/post_00245,Dicta aperiam sunt iste totam unde officiis. #HKVitals #CMPNZ,1460071,87638,6575
POST_00246,INF_0043,Twitter,2025-06-01,https://www.twitter.com/inf_0043/post_00246,Ipsa molestiae voluptate enim temporibus quam laborum ea quam natus itaque excepturi voluptatem esse. #HKVitals #JRTYU,115519,2090,204
POST_00247,INF_0043,Instagram,2025-04-28,https://www.instagram.com/inf_0043/post_00247,Adipisci laudantium cum mollitia delectus rem molestias perferendis magni repudiandae explicabo. #MuscleBlaze #YKHST,679406,34025,5820
POST_00248,INF_0043,Twitter,2025-03-12,https://www.twitter.com/inf_0043/post_00248,Mollitia pariatur ullam dolores architecto eveniet corporis architecto illum unde assumenda repellat cupiditate eius sunt debitis. #Gritzo #DCCXZ,307721,7676,1228
POST_00249,INF_0043,Twitter,2025-03-11,https://www.twitter.com/inf_0043/post_00249,Voluptas velit natus explicabo facere aperiam porro quis minus neque laboriosam excepturi quia nihil repellendus vel. #Gritzo #QILYG,431205,20051,1449
POST_00250,INF_0044,YouTube,2025-04-24,https://www.youtube.com/inf_0044/post_00250,Earum facere a quae sunt quibusdam rem voluptate voluptatem aut cum quibusdam commodi. #Gritzo #TTDSS,319181,12126,1787
POST_00251,INF_0044,Twitter,2024-09-06,https://www.twitter.com/inf_0044/post_00251,Quas consectetur saepe nisi possimus saepe ut nostrum deleniti fugit accusamus. #HKVitals #EDUGX,1160545,10185,2101
POST_00252,INF_0045,Twitter,2025-07-09,https://www.twitter.com/inf_0045/post_00252,Blanditiis nulla qui ad magni consectetur voluptatum quisquam est repellat est rem. #MuscleBlaze #GZQMN,93795,4128,334
